{
"type": "FeatureCollection",
"name": "Brinton",
"crs": { "type": "name", "properties": { "name": "urn:ogc:def:crs:OGC:1.3:CRS84" } },
"features": [
{ "type": "Feature", "properties": { "ID": "1", "Year": "1904", "Month": "January", "Day": "01", "Town": "What Cheer", "State": "IA", "Venue": "Masonic Opera House", "Amount_Made": "56.75", "Notes": "No Data", "Latitude": "41.401397", "Longitude": "-92.354629", "House_takes": "35", "time": "1\/1\/1904", "Amount_Made_real": 56.75, "Amount_Made_D": "$56.75", "House_Takes_P": "35%", "ID_int": 1, "Month_no": "01", "Date": "01-01-1904", "Date_yyyymmdd": "1904-01-01" }, "geometry": { "type": "Point", "coordinates": [ -92.35463, 41.4014 ] } },
{ "type": "Feature", "properties": { "ID": "2", "Year": "1904", "Month": "January", "Day": "02", "Town": "What Cheer", "State": "IA", "Venue": "Masonic Opera House", "Amount_Made": "46.05", "Notes": "No Data", "Latitude": "41.401397", "Longitude": "-92.354629", "House_takes": "35", "time": "1\/2\/1904", "Amount_Made_real": 46.05, "Amount_Made_D": "$46.05", "House_Takes_P": "35%", "ID_int": 2, "Month_no": "01", "Date": "02-01-1904", "Date_yyyymmdd": "1904-01-02" }, "geometry": { "type": "Point", "coordinates": [ -92.35463, 41.4014 ] } },
{ "type": "Feature", "properties": { "ID": "3", "Year": "1904", "Month": "January", "Day": "04", "Town": "Montezuma", "State": "IA", "Venue": "Montezuma Opera House", "Amount_Made": "21.9", "Notes": "No Data", "Latitude": "41.584878", "Longitude": "-92.527431", "House_takes": "25", "time": "1\/4\/1904", "Amount_Made_real": 21.9, "Amount_Made_D": "$21.90", "House_Takes_P": "25%", "ID_int": 3, "Month_no": "01", "Date": "04-01-1904", "Date_yyyymmdd": "1904-01-04" }, "geometry": { "type": "Point", "coordinates": [ -92.52743, 41.58488 ] } },
{ "type": "Feature", "properties": { "ID": "4", "Year": "1904", "Month": "January", "Day": "05", "Town": "Montezuma", "State": "IA", "Venue": "Montezuma Opera House", "Amount_Made": "60.2", "Notes": "No Data", "Latitude": "41.584878", "Longitude": "-92.527431", "House_takes": "25", "time": "1\/5\/1904", "Amount_Made_real": 60.2, "Amount_Made_D": "$60.20", "House_Takes_P": "25%", "ID_int": 4, "Month_no": "01", "Date": "05-01-1904", "Date_yyyymmdd": "1904-01-05" }, "geometry": { "type": "Point", "coordinates": [ -92.52743, 41.58488 ] } },
{ "type": "Feature", "properties": { "ID": "5", "Year": "1904", "Month": "January", "Day": "06", "Town": "Montezuma", "State": "IA", "Venue": "Montezuma Opera House", "Amount_Made": "44.25", "Notes": "No Data", "Latitude": "41.584878", "Longitude": "-92.527431", "House_takes": "25", "time": "1\/6\/1904", "Amount_Made_real": 44.25, "Amount_Made_D": "$44.25", "House_Takes_P": "25%", "ID_int": 5, "Month_no": "01", "Date": "06-01-1904", "Date_yyyymmdd": "1904-01-06" }, "geometry": { "type": "Point", "coordinates": [ -92.52743, 41.58488 ] } },
{ "type": "Feature", "properties": { "ID": "6", "Year": "1904", "Month": "January", "Day": "07", "Town": "North English", "State": "IA", "Venue": "North English, IA", "Amount_Made": "57.15", "Notes": "No Data", "Latitude": "41.513898", "Longitude": "-92.076289", "House_takes": "25", "time": "1\/7\/1904", "Amount_Made_real": 57.15, "Amount_Made_D": "$57.15", "House_Takes_P": "25%", "ID_int": 6, "Month_no": "01", "Date": "07-01-1904", "Date_yyyymmdd": "1904-01-07" }, "geometry": { "type": "Point", "coordinates": [ -92.07629, 41.5139 ] } },
{ "type": "Feature", "properties": { "ID": "7", "Year": "1904", "Month": "January", "Day": "08", "Town": "Williamsburg", "State": "IA", "Venue": "Trojan Opera House: Williamsburg, IA", "Amount_Made": "46.65", "Notes": "Rain and sleet    ", "Latitude": "41.661228", "Longitude": "-92.009506", "House_takes": "25", "time": "1\/8\/1904", "Amount_Made_real": 46.65, "Amount_Made_D": "$46.65", "House_Takes_P": "25%", "ID_int": 7, "Month_no": "01", "Date": "08-01-1904", "Date_yyyymmdd": "1904-01-08" }, "geometry": { "type": "Point", "coordinates": [ -92.00951, 41.66123 ] } },
{ "type": "Feature", "properties": { "ID": "8", "Year": "1904", "Month": "January", "Day": "09", "Town": "Williamsburg", "State": "IA", "Venue": "Trojan Opera House: Williamsburg, IA", "Amount_Made": "47.65", "Notes": "  All night at Cedar Rapids  ", "Latitude": "41.661228", "Longitude": "-92.009506", "House_takes": "25", "time": "1\/9\/1904", "Amount_Made_real": 47.65, "Amount_Made_D": "$47.65", "House_Takes_P": "25%", "ID_int": 8, "Month_no": "01", "Date": "09-01-1904", "Date_yyyymmdd": "1904-01-09" }, "geometry": { "type": "Point", "coordinates": [ -92.00951, 41.66123 ] } },
{ "type": "Feature", "properties": { "ID": "9", "Year": "1904", "Month": "January", "Day": "11", "Town": "Independence", "State": "IA", "Venue": "The Gedney: Independence, IA", "Amount_Made": "47.22", "Notes": "No Data", "Latitude": "42.470465", "Longitude": "-91.892778", "House_takes": "50", "time": "1\/11\/1904", "Amount_Made_real": 47.22, "Amount_Made_D": "$47.22", "House_Takes_P": "50%", "ID_int": 9, "Month_no": "01", "Date": "11-01-1904", "Date_yyyymmdd": "1904-01-11" }, "geometry": { "type": "Point", "coordinates": [ -91.89278, 42.47046 ] } },
{ "type": "Feature", "properties": { "ID": "10", "Year": "1904", "Month": "January", "Day": "12", "Town": "Independence", "State": "IA", "Venue": "The Gedney: Independence, IA", "Amount_Made": "85.15", "Notes": "No Data", "Latitude": "42.470465", "Longitude": "-91.892778", "House_takes": "50", "time": "1\/12\/1904", "Amount_Made_real": 85.15, "Amount_Made_D": "$85.15", "House_Takes_P": "50%", "ID_int": 10, "Month_no": "01", "Date": "12-01-1904", "Date_yyyymmdd": "1904-01-12" }, "geometry": { "type": "Point", "coordinates": [ -91.89278, 42.47046 ] } },
{ "type": "Feature", "properties": { "ID": "11", "Year": "1904", "Month": "January", "Day": "13", "Town": "Independence", "State": "IA", "Venue": "The Gedney: Independence, IA", "Amount_Made": "82.6", "Notes": "No Data", "Latitude": "42.470465", "Longitude": "-91.892778", "House_takes": "50", "time": "1\/13\/1904", "Amount_Made_real": 82.6, "Amount_Made_D": "$82.60", "House_Takes_P": "50%", "ID_int": 11, "Month_no": "01", "Date": "13-01-1904", "Date_yyyymmdd": "1904-01-13" }, "geometry": { "type": "Point", "coordinates": [ -91.89278, 42.47046 ] } },
{ "type": "Feature", "properties": { "ID": "12", "Year": "1904", "Month": "January", "Day": "13", "Town": "Monticello", "State": "IA", "Venue": "Monticello Opera House: Monticello, IA", "Amount_Made": "89.55", "Notes": "No Data", "Latitude": "42.238275", "Longitude": "-91.186943", "House_takes": "30", "time": "1\/13\/1904", "Amount_Made_real": 89.55, "Amount_Made_D": "$89.55", "House_Takes_P": "30%", "ID_int": 12, "Month_no": "01", "Date": "13-01-1904", "Date_yyyymmdd": "1904-01-13" }, "geometry": { "type": "Point", "coordinates": [ -91.18694, 42.23828 ] } },
{ "type": "Feature", "properties": { "ID": "13", "Year": "1904", "Month": "January", "Day": "14", "Town": "Monticello", "State": "IA", "Venue": "Monticello Opera House: Monticello, IA", "Amount_Made": "96.6", "Notes": "No Data", "Latitude": "42.238275", "Longitude": "-91.186943", "House_takes": "30", "time": "1\/14\/1904", "Amount_Made_real": 96.6, "Amount_Made_D": "$96.60", "House_Takes_P": "30%", "ID_int": 13, "Month_no": "01", "Date": "14-01-1904", "Date_yyyymmdd": "1904-01-14" }, "geometry": { "type": "Point", "coordinates": [ -91.18694, 42.23828 ] } },
{ "type": "Feature", "properties": { "ID": "14", "Year": "1904", "Month": "January", "Day": "15", "Town": "Monticello", "State": "IA", "Venue": "Monticello Opera House: Monticello, IA", "Amount_Made": "110.8", "Notes": "No Data", "Latitude": "42.238275", "Longitude": "-91.186943", "House_takes": "30", "time": "1\/15\/1904", "Amount_Made_real": 110.8, "Amount_Made_D": "$110.80", "House_Takes_P": "30%", "ID_int": 14, "Month_no": "01", "Date": "15-01-1904", "Date_yyyymmdd": "1904-01-15" }, "geometry": { "type": "Point", "coordinates": [ -91.18694, 42.23828 ] } },
{ "type": "Feature", "properties": { "ID": "15", "Year": "1904", "Month": "January", "Day": "18", "Town": "Cascade", "State": "IA", "Venue": "Cascade Opera House: Cascade, IA", "Amount_Made": "19.4", "Notes": "No Data", "Latitude": "42.298488", "Longitude": "-91.014223", "House_takes": "25", "time": "1\/18\/1904", "Amount_Made_real": 19.4, "Amount_Made_D": "$19.40", "House_Takes_P": "25%", "ID_int": 15, "Month_no": "01", "Date": "18-01-1904", "Date_yyyymmdd": "1904-01-18" }, "geometry": { "type": "Point", "coordinates": [ -91.01422, 42.29849 ] } },
{ "type": "Feature", "properties": { "ID": "16", "Year": "1904", "Month": "January", "Day": "19", "Town": "Cascade", "State": "IA", "Venue": "Cascade Opera House: Cascade, IA", "Amount_Made": "48.75", "Notes": "Rain and sleet    ", "Latitude": "42.298488", "Longitude": "-91.014223", "House_takes": "25", "time": "1\/19\/1904", "Amount_Made_real": 48.75, "Amount_Made_D": "$48.75", "House_Takes_P": "25%", "ID_int": 16, "Month_no": "01", "Date": "19-01-1904", "Date_yyyymmdd": "1904-01-19" }, "geometry": { "type": "Point", "coordinates": [ -91.01422, 42.29849 ] } },
{ "type": "Feature", "properties": { "ID": "17", "Year": "1904", "Month": "January", "Day": "20", "Town": "Cascade", "State": "IA", "Venue": "Cascade Opera House: Cascade, IA", "Amount_Made": "32.5", "Notes": "No Data", "Latitude": "42.298488", "Longitude": "-91.014223", "House_takes": "25", "time": "1\/20\/1904", "Amount_Made_real": 32.5, "Amount_Made_D": "$32.50", "House_Takes_P": "25%", "ID_int": 17, "Month_no": "01", "Date": "20-01-1904", "Date_yyyymmdd": "1904-01-20" }, "geometry": { "type": "Point", "coordinates": [ -91.01422, 42.29849 ] } },
{ "type": "Feature", "properties": { "ID": "18", "Year": "1904", "Month": "January", "Day": "20", "Town": "Mount Pleasant", "State": "IA", "Venue": "Mount Pleasant, IA", "Amount_Made": "24.25", "Notes": "  Ina left Washington  ", "Latitude": "40.963695", "Longitude": "-91.558073", "House_takes": "0", "time": "1\/20\/1904", "Amount_Made_real": 24.25, "Amount_Made_D": "$24.25", "House_Takes_P": "0%", "ID_int": 18, "Month_no": "01", "Date": "20-01-1904", "Date_yyyymmdd": "1904-01-20" }, "geometry": { "type": "Point", "coordinates": [ -91.55807, 40.9637 ] } },
{ "type": "Feature", "properties": { "ID": "19", "Year": "1904", "Month": "January", "Day": "21", "Town": "Manchester", "State": "IA", "Venue": "Central Opera House: Manchester, IA", "Amount_Made": "14", "Notes": "Cold  Partly free  ", "Latitude": "42.484154", "Longitude": "-91.455425", "House_takes": "25", "time": "1\/21\/1904", "Amount_Made_real": 14.0, "Amount_Made_D": "$14.00", "House_Takes_P": "25%", "ID_int": 19, "Month_no": "01", "Date": "21-01-1904", "Date_yyyymmdd": "1904-01-21" }, "geometry": { "type": "Point", "coordinates": [ -91.45543, 42.48415 ] } },
{ "type": "Feature", "properties": { "ID": "20", "Year": "1904", "Month": "January", "Day": "22", "Town": "Manchester", "State": "IA", "Venue": "Central Opera House: Manchester, IA", "Amount_Made": "25.55", "Notes": "Cold    ", "Latitude": "42.484154", "Longitude": "-91.455425", "House_takes": "25", "time": "1\/22\/1904", "Amount_Made_real": 25.55, "Amount_Made_D": "$25.55", "House_Takes_P": "25%", "ID_int": 20, "Month_no": "01", "Date": "22-01-1904", "Date_yyyymmdd": "1904-01-22" }, "geometry": { "type": "Point", "coordinates": [ -91.45543, 42.48415 ] } },
{ "type": "Feature", "properties": { "ID": "21", "Year": "1904", "Month": "January", "Day": "23", "Town": "Manchester", "State": "IA", "Venue": "Central Opera House: Manchester, IA", "Amount_Made": "5.9", "Notes": "Very cold  Matinee  ", "Latitude": "42.484154", "Longitude": "-91.455425", "House_takes": "0", "time": "1\/23\/1904", "Amount_Made_real": 5.9, "Amount_Made_D": "$5.90", "House_Takes_P": "0%", "ID_int": 21, "Month_no": "01", "Date": "23-01-1904", "Date_yyyymmdd": "1904-01-23" }, "geometry": { "type": "Point", "coordinates": [ -91.45543, 42.48415 ] } },
{ "type": "Feature", "properties": { "ID": "22", "Year": "1904", "Month": "January", "Day": "23", "Town": "Manchester", "State": "IA", "Venue": "Central Opera House: Manchester, IA", "Amount_Made": "21.9", "Notes": "  Evening  ", "Latitude": "42.484154", "Longitude": "-91.455425", "House_takes": "25", "time": "1\/23\/1904", "Amount_Made_real": 21.9, "Amount_Made_D": "$21.90", "House_Takes_P": "25%", "ID_int": 22, "Month_no": "01", "Date": "23-01-1904", "Date_yyyymmdd": "1904-01-23" }, "geometry": { "type": "Point", "coordinates": [ -91.45543, 42.48415 ] } },
{ "type": "Feature", "properties": { "ID": "23", "Year": "1904", "Month": "January", "Day": "25", "Town": "Marshalltown", "State": "IA", "Venue": "Odeon Theatre: Marshalltown, IA", "Amount_Made": "59.2", "Notes": "Extremely cold  Partly free  ", "Latitude": "42.044255", "Longitude": "-92.912339", "House_takes": "50", "time": "1\/25\/1904", "Amount_Made_real": 59.2, "Amount_Made_D": "$59.20", "House_Takes_P": "50%", "ID_int": 23, "Month_no": "01", "Date": "25-01-1904", "Date_yyyymmdd": "1904-01-25" }, "geometry": { "type": "Point", "coordinates": [ -92.91234, 42.04425 ] } },
{ "type": "Feature", "properties": { "ID": "24", "Year": "1904", "Month": "January", "Day": "26", "Town": "Marshalltown", "State": "IA", "Venue": "Odeon Theatre: Marshalltown, IA", "Amount_Made": "50.6", "Notes": "Very cold    ", "Latitude": "42.044255", "Longitude": "-92.912339", "House_takes": "50", "time": "1\/26\/1904", "Amount_Made_real": 50.6, "Amount_Made_D": "$50.60", "House_Takes_P": "50%", "ID_int": 24, "Month_no": "01", "Date": "26-01-1904", "Date_yyyymmdd": "1904-01-26" }, "geometry": { "type": "Point", "coordinates": [ -92.91234, 42.04425 ] } },
{ "type": "Feature", "properties": { "ID": "25", "Year": "1904", "Month": "January", "Day": "27", "Town": "Marshalltown", "State": "IA", "Venue": "Odeon Theatre: Marshalltown, IA", "Amount_Made": "55.5", "Notes": "Cold    ", "Latitude": "42.044255", "Longitude": "-92.912339", "House_takes": "50", "time": "1\/27\/1904", "Amount_Made_real": 55.5, "Amount_Made_D": "$55.50", "House_Takes_P": "50%", "ID_int": 25, "Month_no": "01", "Date": "27-01-1904", "Date_yyyymmdd": "1904-01-27" }, "geometry": { "type": "Point", "coordinates": [ -92.91234, 42.04425 ] } },
{ "type": "Feature", "properties": { "ID": "26", "Year": "1904", "Month": "January", "Day": "28", "Town": "Iowa City", "State": "IA", "Venue": "Coldren Opera House: Iowa City, IA", "Amount_Made": "58.75", "Notes": "Very cold    ", "Latitude": "41.661256", "Longitude": "-91.529911", "House_takes": "50", "time": "1\/28\/1904", "Amount_Made_real": 58.75, "Amount_Made_D": "$58.75", "House_Takes_P": "50%", "ID_int": 26, "Month_no": "01", "Date": "28-01-1904", "Date_yyyymmdd": "1904-01-28" }, "geometry": { "type": "Point", "coordinates": [ -91.52991, 41.66126 ] } },
{ "type": "Feature", "properties": { "ID": "27", "Year": "1904", "Month": "January", "Day": "29", "Town": "Iowa City", "State": "IA", "Venue": "Coldren Opera House: Iowa City, IA", "Amount_Made": "95.95", "Notes": "Cold    ", "Latitude": "41.661256", "Longitude": "-91.529911", "House_takes": "50", "time": "1\/29\/1904", "Amount_Made_real": 95.95, "Amount_Made_D": "$95.95", "House_Takes_P": "50%", "ID_int": 27, "Month_no": "01", "Date": "29-01-1904", "Date_yyyymmdd": "1904-01-29" }, "geometry": { "type": "Point", "coordinates": [ -91.52991, 41.66126 ] } },
{ "type": "Feature", "properties": { "ID": "28", "Year": "1904", "Month": "January", "Day": "30", "Town": "Iowa City", "State": "IA", "Venue": "Coldren Opera House: Iowa City, IA", "Amount_Made": "17.4", "Notes": "  Matinee  ", "Latitude": "41.661256", "Longitude": "-91.529911", "House_takes": "50", "time": "1\/30\/1904", "Amount_Made_real": 17.4, "Amount_Made_D": "$17.40", "House_Takes_P": "50%", "ID_int": 28, "Month_no": "01", "Date": "30-01-1904", "Date_yyyymmdd": "1904-01-30" }, "geometry": { "type": "Point", "coordinates": [ -91.52991, 41.66126 ] } },
{ "type": "Feature", "properties": { "ID": "29", "Year": "1904", "Month": "January", "Day": "31", "Town": "Iowa City", "State": "IA", "Venue": "Coldren Opera House: Iowa City, IA", "Amount_Made": "148.9", "Notes": "No Data", "Latitude": "41.661256", "Longitude": "-91.529911", "House_takes": "50", "time": "1\/31\/1904", "Amount_Made_real": 148.9, "Amount_Made_D": "$148.90", "House_Takes_P": "50%", "ID_int": 29, "Month_no": "01", "Date": "31-01-1904", "Date_yyyymmdd": "1904-01-31" }, "geometry": { "type": "Point", "coordinates": [ -91.52991, 41.66126 ] } },
{ "type": "Feature", "properties": { "ID": "30", "Year": "1904", "Month": "February", "Day": "02", "Town": "West Branch", "State": "IA", "Venue": "Macomber Opera House: West Branch, IA", "Amount_Made": "4.95", "Notes": "partly sunny  Partly free  ", "Latitude": "41.672074", "Longitude": "-91.345973", "House_takes": "25", "time": "2\/2\/1904", "Amount_Made_real": 4.95, "Amount_Made_D": "$4.95", "House_Takes_P": "25%", "ID_int": 30, "Month_no": "02", "Date": "02-02-1904", "Date_yyyymmdd": "1904-02-02" }, "geometry": { "type": "Point", "coordinates": [ -91.34597, 41.67207 ] } },
{ "type": "Feature", "properties": { "ID": "31", "Year": "1904", "Month": "February", "Day": "03", "Town": "West Branch", "State": "IA", "Venue": "Macomber Opera House: West Branch, IA", "Amount_Made": "38.35", "Notes": "No Data", "Latitude": "41.672074", "Longitude": "-91.345973", "House_takes": "25", "time": "2\/3\/1904", "Amount_Made_real": 38.35, "Amount_Made_D": "$38.35", "House_Takes_P": "25%", "ID_int": 31, "Month_no": "02", "Date": "03-02-1904", "Date_yyyymmdd": "1904-02-03" }, "geometry": { "type": "Point", "coordinates": [ -91.34597, 41.67207 ] } },
{ "type": "Feature", "properties": { "ID": "32", "Year": "1904", "Month": "February", "Day": "04", "Town": "Tipton", "State": "IA", "Venue": "Tipton Opera House: Tipton, IA", "Amount_Made": "15.15", "Notes": "  Partly free  ", "Latitude": "41.769743", "Longitude": "-91.127935", "House_takes": "25", "time": "2\/4\/1904", "Amount_Made_real": 15.15, "Amount_Made_D": "$15.15", "House_Takes_P": "25%", "ID_int": 32, "Month_no": "02", "Date": "04-02-1904", "Date_yyyymmdd": "1904-02-04" }, "geometry": { "type": "Point", "coordinates": [ -91.12793, 41.76974 ] } },
{ "type": "Feature", "properties": { "ID": "33", "Year": "1904", "Month": "February", "Day": "05", "Town": "Tipton", "State": "IA", "Venue": "Tipton Opera House: Tipton, IA", "Amount_Made": "44.7", "Notes": "  Roy Martina joined  ", "Latitude": "41.769743", "Longitude": "-91.127935", "House_takes": "25", "time": "2\/5\/1904", "Amount_Made_real": 44.7, "Amount_Made_D": "$44.70", "House_Takes_P": "25%", "ID_int": 33, "Month_no": "02", "Date": "05-02-1904", "Date_yyyymmdd": "1904-02-05" }, "geometry": { "type": "Point", "coordinates": [ -91.12793, 41.76974 ] } },
{ "type": "Feature", "properties": { "ID": "34", "Year": "1904", "Month": "February", "Day": "06", "Town": "Tipton", "State": "IA", "Venue": "Tipton Opera House: Tipton, IA", "Amount_Made": "53.6", "Notes": "No Data", "Latitude": "41.769743", "Longitude": "-91.127935", "House_takes": "25", "time": "2\/6\/1904", "Amount_Made_real": 53.6, "Amount_Made_D": "$53.60", "House_Takes_P": "25%", "ID_int": 34, "Month_no": "02", "Date": "06-02-1904", "Date_yyyymmdd": "1904-02-06" }, "geometry": { "type": "Point", "coordinates": [ -91.12793, 41.76974 ] } },
{ "type": "Feature", "properties": { "ID": "35", "Year": "1904", "Month": "February", "Day": "08", "Town": "Anamosa", "State": "IA", "Venue": "Grand Opera House: Anamosa, IA", "Amount_Made": "54.25", "Notes": "No Data", "Latitude": "42.108337", "Longitude": "-91.285159", "House_takes": "30", "time": "2\/8\/1904", "Amount_Made_real": 54.25, "Amount_Made_D": "$54.25", "House_Takes_P": "30%", "ID_int": 35, "Month_no": "02", "Date": "08-02-1904", "Date_yyyymmdd": "1904-02-08" }, "geometry": { "type": "Point", "coordinates": [ -91.28516, 42.10834 ] } },
{ "type": "Feature", "properties": { "ID": "36", "Year": "1904", "Month": "February", "Day": "09", "Town": "Anamosa", "State": "IA", "Venue": "Grand Opera House: Anamosa, IA", "Amount_Made": "55.75", "Notes": "  Opposition to musical entertainment at the church  ", "Latitude": "42.108337", "Longitude": "-91.285159", "House_takes": "30", "time": "2\/9\/1904", "Amount_Made_real": 55.75, "Amount_Made_D": "$55.75", "House_Takes_P": "30%", "ID_int": 36, "Month_no": "02", "Date": "09-02-1904", "Date_yyyymmdd": "1904-02-09" }, "geometry": { "type": "Point", "coordinates": [ -91.28516, 42.10834 ] } },
{ "type": "Feature", "properties": { "ID": "37", "Year": "1904", "Month": "February", "Day": "10", "Town": "Anamosa", "State": "IA", "Venue": "Grand Opera House: Anamosa, IA", "Amount_Made": "101.85", "Notes": "No Data", "Latitude": "42.108337", "Longitude": "-91.285159", "House_takes": "30", "time": "2\/10\/1904", "Amount_Made_real": 101.85, "Amount_Made_D": "$101.85", "House_Takes_P": "30%", "ID_int": 37, "Month_no": "02", "Date": "10-02-1904", "Date_yyyymmdd": "1904-02-10" }, "geometry": { "type": "Point", "coordinates": [ -91.28516, 42.10834 ] } },
{ "type": "Feature", "properties": { "ID": "38", "Year": "1904", "Month": "February", "Day": "11", "Town": "Owatonna", "State": "MN", "Venue": "Metropolitan Opera House: Owatonna, MN", "Amount_Made": "23.2", "Notes": "  Partly free  ", "Latitude": "44.083994", "Longitude": "-93.226108", "House_takes": "50", "time": "2\/11\/1904", "Amount_Made_real": 23.2, "Amount_Made_D": "$23.20", "House_Takes_P": "50%", "ID_int": 38, "Month_no": "02", "Date": "11-02-1904", "Date_yyyymmdd": "1904-02-11" }, "geometry": { "type": "Point", "coordinates": [ -93.22611, 44.08399 ] } },
{ "type": "Feature", "properties": { "ID": "39", "Year": "1904", "Month": "February", "Day": "12", "Town": "Owatonna", "State": "MN", "Venue": "Metropolitan Opera House: Owatonna, MN", "Amount_Made": "33.65", "Notes": "  Dance and banquet  ", "Latitude": "44.083994", "Longitude": "-93.226108", "House_takes": "50", "time": "2\/12\/1904", "Amount_Made_real": 33.65, "Amount_Made_D": "$33.65", "House_Takes_P": "50%", "ID_int": 39, "Month_no": "02", "Date": "12-02-1904", "Date_yyyymmdd": "1904-02-12" }, "geometry": { "type": "Point", "coordinates": [ -93.22611, 44.08399 ] } },
{ "type": "Feature", "properties": { "ID": "40", "Year": "1904", "Month": "February", "Day": "13", "Town": "Owatonna", "State": "MN", "Venue": "Metropolitan Opera House: Owatonna, MN", "Amount_Made": "52.4", "Notes": "  Masquerade dance  ", "Latitude": "44.083994", "Longitude": "-93.226108", "House_takes": "50", "time": "2\/13\/1904", "Amount_Made_real": 52.4, "Amount_Made_D": "$52.40", "House_Takes_P": "50%", "ID_int": 40, "Month_no": "02", "Date": "13-02-1904", "Date_yyyymmdd": "1904-02-13" }, "geometry": { "type": "Point", "coordinates": [ -93.22611, 44.08399 ] } },
{ "type": "Feature", "properties": { "ID": "41", "Year": "1904", "Month": "February", "Day": "15", "Town": "Faribault", "State": "MN", "Venue": "Grand Opera House: Faribault, MN", "Amount_Made": "62.6", "Notes": "Very cold  Partly free  ", "Latitude": "44.296188", "Longitude": "-93.29026", "House_takes": "50", "time": "2\/15\/1904", "Amount_Made_real": 62.6, "Amount_Made_D": "$62.60", "House_Takes_P": "50%", "ID_int": 41, "Month_no": "02", "Date": "15-02-1904", "Date_yyyymmdd": "1904-02-15" }, "geometry": { "type": "Point", "coordinates": [ -93.29026, 44.29619 ] } },
{ "type": "Feature", "properties": { "ID": "42", "Year": "1904", "Month": "February", "Day": "16", "Town": "Faribault", "State": "MN", "Venue": "Grand Opera House: Faribault, MN", "Amount_Made": "56.8", "Notes": "Very cold    ", "Latitude": "44.296188", "Longitude": "-93.29026", "House_takes": "50", "time": "2\/16\/1904", "Amount_Made_real": 56.8, "Amount_Made_D": "$56.80", "House_Takes_P": "50%", "ID_int": 42, "Month_no": "02", "Date": "16-02-1904", "Date_yyyymmdd": "1904-02-16" }, "geometry": { "type": "Point", "coordinates": [ -93.29026, 44.29619 ] } },
{ "type": "Feature", "properties": { "ID": "43", "Year": "1904", "Month": "February", "Day": "17", "Town": "Faribault", "State": "MN", "Venue": "Grand Opera House: Faribault, MN", "Amount_Made": "76.95", "Notes": "Snow and cold    ", "Latitude": "44.296188", "Longitude": "-93.29026", "House_takes": "50", "time": "2\/17\/1904", "Amount_Made_real": 76.95, "Amount_Made_D": "$76.95", "House_Takes_P": "50%", "ID_int": 43, "Month_no": "02", "Date": "17-02-1904", "Date_yyyymmdd": "1904-02-17" }, "geometry": { "type": "Point", "coordinates": [ -93.29026, 44.29619 ] } },
{ "type": "Feature", "properties": { "ID": "44", "Year": "1904", "Month": "February", "Day": "18", "Town": "Waseca", "State": "MN", "Venue": "Ward Opera House: Waseca, MN", "Amount_Made": "39", "Notes": "  Partly free  ", "Latitude": "44.017224", "Longitude": "-93.588572", "House_takes": "30", "time": "2\/18\/1904", "Amount_Made_real": 39.0, "Amount_Made_D": "$39.00", "House_Takes_P": "30%", "ID_int": 44, "Month_no": "02", "Date": "18-02-1904", "Date_yyyymmdd": "1904-02-18" }, "geometry": { "type": "Point", "coordinates": [ -93.58857, 44.01722 ] } },
{ "type": "Feature", "properties": { "ID": "45", "Year": "1904", "Month": "February", "Day": "19", "Town": "Waseca", "State": "MN", "Venue": "Ward Opera House: Waseca, MN", "Amount_Made": "49.4", "Notes": "No Data", "Latitude": "44.017224", "Longitude": "-93.588572", "House_takes": "30", "time": "2\/19\/1904", "Amount_Made_real": 49.4, "Amount_Made_D": "$49.40", "House_Takes_P": "30%", "ID_int": 45, "Month_no": "02", "Date": "19-02-1904", "Date_yyyymmdd": "1904-02-19" }, "geometry": { "type": "Point", "coordinates": [ -93.58857, 44.01722 ] } },
{ "type": "Feature", "properties": { "ID": "46", "Year": "1904", "Month": "February", "Day": "20", "Town": "Waseca", "State": "MN", "Venue": "Ward Opera House: Waseca, MN", "Amount_Made": "55.85", "Notes": "No Data", "Latitude": "44.017224", "Longitude": "-93.588572", "House_takes": "30", "time": "2\/20\/1904", "Amount_Made_real": 55.85, "Amount_Made_D": "$55.85", "House_Takes_P": "30%", "ID_int": 46, "Month_no": "02", "Date": "20-02-1904", "Date_yyyymmdd": "1904-02-20" }, "geometry": { "type": "Point", "coordinates": [ -93.58857, 44.01722 ] } },
{ "type": "Feature", "properties": { "ID": "47", "Year": "1904", "Month": "February", "Day": "22", "Town": "Waterville", "State": "MN", "Venue": "Waterville, MN", "Amount_Made": "26", "Notes": "  Partly free\n[House takes] $22.00 cash for 3 nights [February 22, 23, 24]  ", "Latitude": "44.218991", "Longitude": "-93.56797", "House_takes": "0", "time": "2\/22\/1904", "Amount_Made_real": 26.0, "Amount_Made_D": "$26.00", "House_Takes_P": "0%", "ID_int": 47, "Month_no": "02", "Date": "22-02-1904", "Date_yyyymmdd": "1904-02-22" }, "geometry": { "type": "Point", "coordinates": [ -93.56797, 44.21899 ] } },
{ "type": "Feature", "properties": { "ID": "48", "Year": "1904", "Month": "February", "Day": "23", "Town": "Waterville", "State": "MN", "Venue": "Waterville, MN", "Amount_Made": "67.45", "Notes": "  [House takes] $22.00 cash for 3 nights [February 22, 23, 24]  ", "Latitude": "44.218991", "Longitude": "-93.56797", "House_takes": "0", "time": "2\/23\/1904", "Amount_Made_real": 67.45, "Amount_Made_D": "$67.45", "House_Takes_P": "0%", "ID_int": 48, "Month_no": "02", "Date": "23-02-1904", "Date_yyyymmdd": "1904-02-23" }, "geometry": { "type": "Point", "coordinates": [ -93.56797, 44.21899 ] } },
{ "type": "Feature", "properties": { "ID": "49", "Year": "1904", "Month": "February", "Day": "24", "Town": "Waterville", "State": "MN", "Venue": "Waterville, MN", "Amount_Made": "70.45", "Notes": "  [House takes] $22.00 cash for 3 nights [February 22, 23, 24]  ", "Latitude": "44.218991", "Longitude": "-93.56797", "House_takes": "0", "time": "2\/24\/1904", "Amount_Made_real": 70.45, "Amount_Made_D": "$70.45", "House_Takes_P": "0%", "ID_int": 49, "Month_no": "02", "Date": "24-02-1904", "Date_yyyymmdd": "1904-02-24" }, "geometry": { "type": "Point", "coordinates": [ -93.56797, 44.21899 ] } },
{ "type": "Feature", "properties": { "ID": "50", "Year": "1904", "Month": "February", "Day": "25", "Town": "New Ulm", "State": "MN", "Venue": "Turner Opera House: New Ulm, MN", "Amount_Made": "12.45", "Notes": "  Partly free  ", "Latitude": "44.28212", "Longitude": "-94.451855", "House_takes": "20", "time": "2\/25\/1904", "Amount_Made_real": 12.45, "Amount_Made_D": "$12.45", "House_Takes_P": "20%", "ID_int": 50, "Month_no": "02", "Date": "25-02-1904", "Date_yyyymmdd": "1904-02-25" }, "geometry": { "type": "Point", "coordinates": [ -94.45185, 44.28212 ] } },
{ "type": "Feature", "properties": { "ID": "51", "Year": "1904", "Month": "February", "Day": "26", "Town": "New Ulm", "State": "MN", "Venue": "Turner Opera House: New Ulm, MN", "Amount_Made": "55.1", "Notes": "No Data", "Latitude": "44.28212", "Longitude": "-94.451855", "House_takes": "20", "time": "2\/26\/1904", "Amount_Made_real": 55.1, "Amount_Made_D": "$55.10", "House_Takes_P": "20%", "ID_int": 51, "Month_no": "02", "Date": "26-02-1904", "Date_yyyymmdd": "1904-02-26" }, "geometry": { "type": "Point", "coordinates": [ -94.45185, 44.28212 ] } },
{ "type": "Feature", "properties": { "ID": "52", "Year": "1904", "Month": "February", "Day": "27", "Town": "New Ulm", "State": "MN", "Venue": "Turner Opera House: New Ulm, MN", "Amount_Made": "82.05", "Notes": "No Data", "Latitude": "44.28212", "Longitude": "-94.451855", "House_takes": "20", "time": "2\/27\/1904", "Amount_Made_real": 82.05, "Amount_Made_D": "$82.05", "House_Takes_P": "20%", "ID_int": 52, "Month_no": "02", "Date": "27-02-1904", "Date_yyyymmdd": "1904-02-27" }, "geometry": { "type": "Point", "coordinates": [ -94.45185, 44.28212 ] } },
{ "type": "Feature", "properties": { "ID": "53", "Year": "1904", "Month": "February", "Day": "29", "Town": "Saint Peter", "State": "MN", "Venue": "Rost's Hall: Saint Peter, MN", "Amount_Made": "17.55", "Notes": "  [House takes] $21 taken total for 3 nights [February 29, March 1, 2]\nPartly free  ", "Latitude": "44.323838", "Longitude": "-93.958529", "House_takes": "0", "time": "2\/29\/1904", "Amount_Made_real": 17.55, "Amount_Made_D": "$17.55", "House_Takes_P": "0%", "ID_int": 53, "Month_no": "02", "Date": "29-02-1904", "Date_yyyymmdd": "1904-02-29" }, "geometry": { "type": "Point", "coordinates": [ -93.95853, 44.32384 ] } },
{ "type": "Feature", "properties": { "ID": "54", "Year": "1904", "Month": "March", "Day": "01", "Town": "Saint Peter", "State": "MN", "Venue": "Rost's Hall: Saint Peter, MN", "Amount_Made": "31.85", "Notes": "Bad weather  [House takes] $21 taken total for 3 nights [February 29, March 1, 2]  ", "Latitude": "44.323838", "Longitude": "-93.958529", "House_takes": "0", "time": "3\/1\/1904", "Amount_Made_real": 31.85, "Amount_Made_D": "$31.85", "House_Takes_P": "0%", "ID_int": 54, "Month_no": "03", "Date": "01-03-1904", "Date_yyyymmdd": "1904-03-01" }, "geometry": { "type": "Point", "coordinates": [ -93.95853, 44.32384 ] } },
{ "type": "Feature", "properties": { "ID": "55", "Year": "1904", "Month": "March", "Day": "02", "Town": "Saint Peter", "State": "MN", "Venue": "Rost's Hall: Saint Peter, MN", "Amount_Made": "31.85", "Notes": "  [House takes] $21 taken total for 3 nights [February 29, March 1, 2]  ", "Latitude": "44.323838", "Longitude": "-93.958529", "House_takes": "0", "time": "3\/2\/1904", "Amount_Made_real": 31.85, "Amount_Made_D": "$31.85", "House_Takes_P": "0%", "ID_int": 55, "Month_no": "03", "Date": "02-03-1904", "Date_yyyymmdd": "1904-03-02" }, "geometry": { "type": "Point", "coordinates": [ -93.95853, 44.32384 ] } },
{ "type": "Feature", "properties": { "ID": "56", "Year": "1904", "Month": "March", "Day": "03", "Town": "Rochester", "State": "MN", "Venue": "Rochester, MN", "Amount_Made": "39.4", "Notes": "No Data", "Latitude": "44.023327", "Longitude": "-92.463021", "House_takes": "50", "time": "3\/3\/1904", "Amount_Made_real": 39.4, "Amount_Made_D": "$39.40", "House_Takes_P": "50%", "ID_int": 56, "Month_no": "03", "Date": "03-03-1904", "Date_yyyymmdd": "1904-03-03" }, "geometry": { "type": "Point", "coordinates": [ -92.46302, 44.02333 ] } },
{ "type": "Feature", "properties": { "ID": "57", "Year": "1904", "Month": "March", "Day": "04", "Town": "Rochester", "State": "MN", "Venue": "Rochester, MN", "Amount_Made": "64", "Notes": "No Data", "Latitude": "44.023327", "Longitude": "-92.463021", "House_takes": "50", "time": "3\/4\/1904", "Amount_Made_real": 64.0, "Amount_Made_D": "$64.00", "House_Takes_P": "50%", "ID_int": 57, "Month_no": "03", "Date": "04-03-1904", "Date_yyyymmdd": "1904-03-04" }, "geometry": { "type": "Point", "coordinates": [ -92.46302, 44.02333 ] } },
{ "type": "Feature", "properties": { "ID": "58", "Year": "1904", "Month": "March", "Day": "05", "Town": "Rochester", "State": "MN", "Venue": "Rochester, MN", "Amount_Made": "84.5", "Notes": "No Data", "Latitude": "44.023327", "Longitude": "-92.463021", "House_takes": "50", "time": "3\/5\/1904", "Amount_Made_real": 84.5, "Amount_Made_D": "$84.50", "House_Takes_P": "50%", "ID_int": 58, "Month_no": "03", "Date": "05-03-1904", "Date_yyyymmdd": "1904-03-05" }, "geometry": { "type": "Point", "coordinates": [ -92.46302, 44.02333 ] } },
{ "type": "Feature", "properties": { "ID": "59", "Year": "1904", "Month": "March", "Day": "07", "Town": "Saint Charles", "State": "MN", "Venue": "Saint Charles, MN", "Amount_Made": "19.25", "Notes": "  Parly free  ", "Latitude": "43.969361", "Longitude": "-92.065982", "House_takes": "30", "time": "3\/7\/1904", "Amount_Made_real": 19.25, "Amount_Made_D": "$19.25", "House_Takes_P": "30%", "ID_int": 59, "Month_no": "03", "Date": "07-03-1904", "Date_yyyymmdd": "1904-03-07" }, "geometry": { "type": "Point", "coordinates": [ -92.06598, 43.96936 ] } },
{ "type": "Feature", "properties": { "ID": "60", "Year": "1904", "Month": "March", "Day": "08", "Town": "Saint Charles", "State": "MN", "Venue": "Saint Charles, MN", "Amount_Made": "58.8", "Notes": "No Data", "Latitude": "43.969361", "Longitude": "-92.065982", "House_takes": "30", "time": "3\/8\/1904", "Amount_Made_real": 58.8, "Amount_Made_D": "$58.80", "House_Takes_P": "30%", "ID_int": 60, "Month_no": "03", "Date": "08-03-1904", "Date_yyyymmdd": "1904-03-08" }, "geometry": { "type": "Point", "coordinates": [ -92.06598, 43.96936 ] } },
{ "type": "Feature", "properties": { "ID": "61", "Year": "1904", "Month": "March", "Day": "09", "Town": "Saint Charles", "State": "MN", "Venue": "Saint Charles, MN", "Amount_Made": "62.05", "Notes": "No Data", "Latitude": "43.969361", "Longitude": "-92.065982", "House_takes": "30", "time": "3\/9\/1904", "Amount_Made_real": 62.05, "Amount_Made_D": "$62.05", "House_Takes_P": "30%", "ID_int": 61, "Month_no": "03", "Date": "09-03-1904", "Date_yyyymmdd": "1904-03-09" }, "geometry": { "type": "Point", "coordinates": [ -92.06598, 43.96936 ] } },
{ "type": "Feature", "properties": { "ID": "62", "Year": "1904", "Month": "March", "Day": "10", "Town": "Winona", "State": "MN", "Venue": "Winona, MN", "Amount_Made": "60.7", "Notes": "  Partly free  ", "Latitude": "44.050005", "Longitude": "-91.639229", "House_takes": "50", "time": "3\/10\/1904", "Amount_Made_real": 60.7, "Amount_Made_D": "$60.70", "House_Takes_P": "50%", "ID_int": 62, "Month_no": "03", "Date": "10-03-1904", "Date_yyyymmdd": "1904-03-10" }, "geometry": { "type": "Point", "coordinates": [ -91.63923, 44.05 ] } },
{ "type": "Feature", "properties": { "ID": "63", "Year": "1904", "Month": "March", "Day": "11", "Town": "Winona", "State": "MN", "Venue": "Winona, MN", "Amount_Made": "84.9", "Notes": "No Data", "Latitude": "44.050005", "Longitude": "-91.639229", "House_takes": "50", "time": "3\/11\/1904", "Amount_Made_real": 84.9, "Amount_Made_D": "$84.90", "House_Takes_P": "50%", "ID_int": 63, "Month_no": "03", "Date": "11-03-1904", "Date_yyyymmdd": "1904-03-11" }, "geometry": { "type": "Point", "coordinates": [ -91.63923, 44.05 ] } },
{ "type": "Feature", "properties": { "ID": "64", "Year": "1904", "Month": "March", "Day": "12", "Town": "Winona", "State": "MN", "Venue": "Winona, MN", "Amount_Made": "117.3", "Notes": "  Partly free  ", "Latitude": "44.050005", "Longitude": "-91.639229", "House_takes": "50", "time": "3\/12\/1904", "Amount_Made_real": 117.3, "Amount_Made_D": "$117.30", "House_Takes_P": "50%", "ID_int": 64, "Month_no": "03", "Date": "12-03-1904", "Date_yyyymmdd": "1904-03-12" }, "geometry": { "type": "Point", "coordinates": [ -91.63923, 44.05 ] } },
{ "type": "Feature", "properties": { "ID": "65", "Year": "1904", "Month": "March", "Day": "14", "Town": "Chatfield", "State": "MN", "Venue": "Chatfield, MN", "Amount_Made": "8.85", "Notes": "  Partly free  ", "Latitude": "43.84463", "Longitude": "-92.188091", "House_takes": "20", "time": "3\/14\/1904", "Amount_Made_real": 8.85, "Amount_Made_D": "$8.85", "House_Takes_P": "20%", "ID_int": 65, "Month_no": "03", "Date": "14-03-1904", "Date_yyyymmdd": "1904-03-14" }, "geometry": { "type": "Point", "coordinates": [ -92.18809, 43.84463 ] } },
{ "type": "Feature", "properties": { "ID": "66", "Year": "1904", "Month": "March", "Day": "15", "Town": "Winona", "State": "MN", "Venue": "Winona, MN", "Amount_Made": "44.95", "Notes": "No Data", "Latitude": "44.050005", "Longitude": "-91.639229", "House_takes": "50", "time": "3\/15\/1904", "Amount_Made_real": 44.95, "Amount_Made_D": "$44.95", "House_Takes_P": "50%", "ID_int": 66, "Month_no": "03", "Date": "15-03-1904", "Date_yyyymmdd": "1904-03-15" }, "geometry": { "type": "Point", "coordinates": [ -91.63923, 44.05 ] } },
{ "type": "Feature", "properties": { "ID": "67", "Year": "1904", "Month": "March", "Day": "16", "Town": "Chatfield", "State": "MN", "Venue": "Chatfield, MN", "Amount_Made": "56.55", "Notes": "No Data", "Latitude": "43.84463", "Longitude": "-92.188091", "House_takes": "25", "time": "3\/16\/1904", "Amount_Made_real": 56.55, "Amount_Made_D": "$56.55", "House_Takes_P": "25%", "ID_int": 67, "Month_no": "03", "Date": "16-03-1904", "Date_yyyymmdd": "1904-03-16" }, "geometry": { "type": "Point", "coordinates": [ -92.18809, 43.84463 ] } },
{ "type": "Feature", "properties": { "ID": "68", "Year": "1904", "Month": "March", "Day": "17", "Town": "Chatfield", "State": "MN", "Venue": "Chatfield, MN", "Amount_Made": "54.65", "Notes": "No Data", "Latitude": "43.84463", "Longitude": "-92.188091", "House_takes": "25", "time": "3\/17\/1904", "Amount_Made_real": 54.65, "Amount_Made_D": "$54.65", "House_Takes_P": "25%", "ID_int": 68, "Month_no": "03", "Date": "17-03-1904", "Date_yyyymmdd": "1904-03-17" }, "geometry": { "type": "Point", "coordinates": [ -92.18809, 43.84463 ] } },
{ "type": "Feature", "properties": { "ID": "69", "Year": "1904", "Month": "March", "Day": "18", "Town": "Winona", "State": "MN", "Venue": "Winona, MN", "Amount_Made": "39.8", "Notes": "Rainy    ", "Latitude": "44.050005", "Longitude": "-91.639229", "House_takes": "25", "time": "3\/18\/1904", "Amount_Made_real": 39.8, "Amount_Made_D": "$39.80", "House_Takes_P": "25%", "ID_int": 69, "Month_no": "03", "Date": "18-03-1904", "Date_yyyymmdd": "1904-03-18" }, "geometry": { "type": "Point", "coordinates": [ -91.63923, 44.05 ] } },
{ "type": "Feature", "properties": { "ID": "70", "Year": "1904", "Month": "March", "Day": "19", "Town": "Rochester", "State": "MN", "Venue": "Rochester, MN", "Amount_Made": "83.3", "Notes": "No Data", "Latitude": "44.023327", "Longitude": "-92.463021", "House_takes": "50", "time": "3\/19\/1904", "Amount_Made_real": 83.3, "Amount_Made_D": "$83.30", "House_Takes_P": "50%", "ID_int": 70, "Month_no": "03", "Date": "19-03-1904", "Date_yyyymmdd": "1904-03-19" }, "geometry": { "type": "Point", "coordinates": [ -92.46302, 44.02333 ] } },
{ "type": "Feature", "properties": { "ID": "71", "Year": "1904", "Month": "March", "Day": "21", "Town": "Waseca", "State": "MN", "Venue": "Ward Opera House: Waseca, MN", "Amount_Made": "23.35", "Notes": "Misty & muddy    ", "Latitude": "44.017224", "Longitude": "-93.588572", "House_takes": "30", "time": "3\/21\/1904", "Amount_Made_real": 23.35, "Amount_Made_D": "$23.35", "House_Takes_P": "30%", "ID_int": 71, "Month_no": "03", "Date": "21-03-1904", "Date_yyyymmdd": "1904-03-21" }, "geometry": { "type": "Point", "coordinates": [ -93.58857, 44.01722 ] } },
{ "type": "Feature", "properties": { "ID": "72", "Year": "1904", "Month": "March", "Day": "22", "Town": "Owatonna", "State": "MN", "Venue": "Metropolitan Opera House: Owatonna, MN", "Amount_Made": "42.25", "Notes": "No Data", "Latitude": "44.083994", "Longitude": "-93.226108", "House_takes": "50", "time": "3\/22\/1904", "Amount_Made_real": 42.25, "Amount_Made_D": "$42.25", "House_Takes_P": "50%", "ID_int": 72, "Month_no": "03", "Date": "22-03-1904", "Date_yyyymmdd": "1904-03-22" }, "geometry": { "type": "Point", "coordinates": [ -93.22611, 44.08399 ] } },
{ "type": "Feature", "properties": { "ID": "73", "Year": "1904", "Month": "March", "Day": "23", "Town": "Faribault", "State": "MN", "Venue": "Grand Opera House: Faribault, MN", "Amount_Made": "4.15", "Notes": "No Data", "Latitude": "44.296188", "Longitude": "-93.29026", "House_takes": "50", "time": "3\/23\/1904", "Amount_Made_real": 4.15, "Amount_Made_D": "$4.15", "House_Takes_P": "50%", "ID_int": 73, "Month_no": "03", "Date": "23-03-1904", "Date_yyyymmdd": "1904-03-23" }, "geometry": { "type": "Point", "coordinates": [ -93.29026, 44.29619 ] } },
{ "type": "Feature", "properties": { "ID": "74", "Year": "1904", "Month": "March", "Day": "24", "Town": "Mankato", "State": "MN", "Venue": "Mankato Theatre: Mankato, MN", "Amount_Made": "12.85", "Notes": "Rainy  Partly free\nPoorly advertised   ", "Latitude": "44.163466", "Longitude": "-93.99935", "House_takes": "50", "time": "3\/24\/1904", "Amount_Made_real": 12.85, "Amount_Made_D": "$12.85", "House_Takes_P": "50%", "ID_int": 74, "Month_no": "03", "Date": "24-03-1904", "Date_yyyymmdd": "1904-03-24" }, "geometry": { "type": "Point", "coordinates": [ -93.99935, 44.16347 ] } },
{ "type": "Feature", "properties": { "ID": "75", "Year": "1904", "Month": "March", "Day": "25", "Town": "Mankato", "State": "MN", "Venue": "Mankato Theatre: Mankato, MN", "Amount_Made": "25.9", "Notes": "No Data", "Latitude": "44.163466", "Longitude": "-93.99935", "House_takes": "50", "time": "3\/25\/1904", "Amount_Made_real": 25.9, "Amount_Made_D": "$25.90", "House_Takes_P": "50%", "ID_int": 75, "Month_no": "03", "Date": "25-03-1904", "Date_yyyymmdd": "1904-03-25" }, "geometry": { "type": "Point", "coordinates": [ -93.99935, 44.16347 ] } },
{ "type": "Feature", "properties": { "ID": "76", "Year": "1904", "Month": "March", "Day": "26", "Town": "Mankato", "State": "MN", "Venue": "Mankato Theatre: Mankato, MN", "Amount_Made": "45.5", "Notes": "No Data", "Latitude": "44.163466", "Longitude": "-93.99935", "House_takes": "50", "time": "3\/26\/1904", "Amount_Made_real": 45.5, "Amount_Made_D": "$45.50", "House_Takes_P": "50%", "ID_int": 76, "Month_no": "03", "Date": "26-03-1904", "Date_yyyymmdd": "1904-03-26" }, "geometry": { "type": "Point", "coordinates": [ -93.99935, 44.16347 ] } },
{ "type": "Feature", "properties": { "ID": "77", "Year": "1904", "Month": "March", "Day": "28", "Town": "Waterville", "State": "MN", "Venue": "Waterville, MN", "Amount_Made": "47.9", "Notes": "No Data", "Latitude": "44.218991", "Longitude": "-93.56797", "House_takes": "25", "time": "3\/28\/1904", "Amount_Made_real": 47.9, "Amount_Made_D": "$47.90", "House_Takes_P": "25%", "ID_int": 77, "Month_no": "03", "Date": "28-03-1904", "Date_yyyymmdd": "1904-03-28" }, "geometry": { "type": "Point", "coordinates": [ -93.56797, 44.21899 ] } },
{ "type": "Feature", "properties": { "ID": "78", "Year": "1904", "Month": "March", "Day": "29", "Town": "Saint Peter", "State": "MN", "Venue": "Rost's Hall: Saint Peter, MN", "Amount_Made": "19.35", "Notes": "Rainy  [House takes] $7 cash  ", "Latitude": "44.323838", "Longitude": "-93.958529", "House_takes": "36.2", "time": "3\/29\/1904", "Amount_Made_real": 19.35, "Amount_Made_D": "$19.35", "House_Takes_P": "36.2%", "ID_int": 78, "Month_no": "03", "Date": "29-03-1904", "Date_yyyymmdd": "1904-03-29" }, "geometry": { "type": "Point", "coordinates": [ -93.95853, 44.32384 ] } },
{ "type": "Feature", "properties": { "ID": "79", "Year": "1904", "Month": "March", "Day": "30", "Town": "Saint Peter", "State": "MN", "Venue": "Rost's Hall: Saint Peter, MN", "Amount_Made": "17.3", "Notes": "Rainy  [House takes] $7 cash  ", "Latitude": "44.323838", "Longitude": "-93.958529", "House_takes": "40.5", "time": "3\/30\/1904", "Amount_Made_real": 17.3, "Amount_Made_D": "$17.30", "House_Takes_P": "40.5%", "ID_int": 79, "Month_no": "03", "Date": "30-03-1904", "Date_yyyymmdd": "1904-03-30" }, "geometry": { "type": "Point", "coordinates": [ -93.95853, 44.32384 ] } },
{ "type": "Feature", "properties": { "ID": "80", "Year": "1904", "Month": "March", "Day": "31", "Town": "Wells", "State": "MN", "Venue": "G.A.R. Hall: Wells, MN", "Amount_Made": "12.5", "Notes": "  Partly free  ", "Latitude": "43.746066", "Longitude": "-93.728836", "House_takes": "25", "time": "3\/31\/1904", "Amount_Made_real": 12.5, "Amount_Made_D": "$12.50", "House_Takes_P": "25%", "ID_int": 80, "Month_no": "03", "Date": "31-03-1904", "Date_yyyymmdd": "1904-03-31" }, "geometry": { "type": "Point", "coordinates": [ -93.72884, 43.74607 ] } },
{ "type": "Feature", "properties": { "ID": "81", "Year": "1904", "Month": "April", "Day": "01", "Town": "Wells", "State": "MN", "Venue": "G.A.R. Hall: Wells, MN", "Amount_Made": "24.8", "Notes": "No Data", "Latitude": "43.746066", "Longitude": "-93.728836", "House_takes": "25", "time": "4\/1\/1904", "Amount_Made_real": 24.8, "Amount_Made_D": "$24.80", "House_Takes_P": "25%", "ID_int": 81, "Month_no": "04", "Date": "01-04-1904", "Date_yyyymmdd": "1904-04-01" }, "geometry": { "type": "Point", "coordinates": [ -93.72884, 43.74607 ] } },
{ "type": "Feature", "properties": { "ID": "82", "Year": "1904", "Month": "April", "Day": "02", "Town": "Wells", "State": "MN", "Venue": "G.A.R. Hall: Wells, MN", "Amount_Made": "29.1", "Notes": "No Data", "Latitude": "43.746066", "Longitude": "-93.728836", "House_takes": "25", "time": "4\/2\/1904", "Amount_Made_real": 29.1, "Amount_Made_D": "$29.10", "House_Takes_P": "25%", "ID_int": 82, "Month_no": "04", "Date": "02-04-1904", "Date_yyyymmdd": "1904-04-02" }, "geometry": { "type": "Point", "coordinates": [ -93.72884, 43.74607 ] } },
{ "type": "Feature", "properties": { "ID": "83", "Year": "1904", "Month": "April", "Day": "04", "Town": "Charles City", "State": "IA", "Venue": "Hildreth Opera House", "Amount_Made": "59.65", "Notes": "  Partly free  ", "Latitude": "43.066361", "Longitude": "-92.672411", "House_takes": "50", "time": "4\/4\/1904", "Amount_Made_real": 59.65, "Amount_Made_D": "$59.65", "House_Takes_P": "50%", "ID_int": 83, "Month_no": "04", "Date": "04-04-1904", "Date_yyyymmdd": "1904-04-04" }, "geometry": { "type": "Point", "coordinates": [ -92.67241, 43.06636 ] } },
{ "type": "Feature", "properties": { "ID": "84", "Year": "1904", "Month": "April", "Day": "05", "Town": "Charles City", "State": "IA", "Venue": "Hildreth Opera House", "Amount_Made": "91", "Notes": "No Data", "Latitude": "43.066361", "Longitude": "-92.672411", "House_takes": "50", "time": "4\/5\/1904", "Amount_Made_real": 91.0, "Amount_Made_D": "$91.00", "House_Takes_P": "50%", "ID_int": 84, "Month_no": "04", "Date": "05-04-1904", "Date_yyyymmdd": "1904-04-05" }, "geometry": { "type": "Point", "coordinates": [ -92.67241, 43.06636 ] } },
{ "type": "Feature", "properties": { "ID": "85", "Year": "1904", "Month": "April", "Day": "06", "Town": "Charles City", "State": "IA", "Venue": "Hildreth Opera House", "Amount_Made": "106.6", "Notes": "  big banquet rollerskating etc.  ", "Latitude": "43.066361", "Longitude": "-92.672411", "House_takes": "50", "time": "4\/6\/1904", "Amount_Made_real": 106.6, "Amount_Made_D": "$106.60", "House_Takes_P": "50%", "ID_int": 85, "Month_no": "04", "Date": "06-04-1904", "Date_yyyymmdd": "1904-04-06" }, "geometry": { "type": "Point", "coordinates": [ -92.67241, 43.06636 ] } },
{ "type": "Feature", "properties": { "ID": "86", "Year": "1904", "Month": "April", "Day": "07", "Town": "Waverly", "State": "IA", "Venue": "Waverly Opera House: Waverly, IA", "Amount_Made": "15.55", "Notes": "Rainy  Partly free  ", "Latitude": "42.725814", "Longitude": "-92.475463", "House_takes": "35", "time": "4\/7\/1904", "Amount_Made_real": 15.55, "Amount_Made_D": "$15.55", "House_Takes_P": "35%", "ID_int": 86, "Month_no": "04", "Date": "07-04-1904", "Date_yyyymmdd": "1904-04-07" }, "geometry": { "type": "Point", "coordinates": [ -92.47546, 42.72581 ] } },
{ "type": "Feature", "properties": { "ID": "87", "Year": "1904", "Month": "April", "Day": "08", "Town": "Waverly", "State": "IA", "Venue": "Waverly Opera House: Waverly, IA", "Amount_Made": "42.65", "Notes": "Rainy    ", "Latitude": "42.725814", "Longitude": "-92.475463", "House_takes": "35", "time": "4\/8\/1904", "Amount_Made_real": 42.65, "Amount_Made_D": "$42.65", "House_Takes_P": "35%", "ID_int": 87, "Month_no": "04", "Date": "08-04-1904", "Date_yyyymmdd": "1904-04-08" }, "geometry": { "type": "Point", "coordinates": [ -92.47546, 42.72581 ] } },
{ "type": "Feature", "properties": { "ID": "88", "Year": "1904", "Month": "April", "Day": "09", "Town": "Waverly", "State": "IA", "Venue": "Waverly Opera House: Waverly, IA", "Amount_Made": "45.7", "Notes": "Cloudy and cold    ", "Latitude": "42.725814", "Longitude": "-92.475463", "House_takes": "35", "time": "4\/9\/1904", "Amount_Made_real": 45.7, "Amount_Made_D": "$45.70", "House_Takes_P": "35%", "ID_int": 88, "Month_no": "04", "Date": "09-04-1904", "Date_yyyymmdd": "1904-04-09" }, "geometry": { "type": "Point", "coordinates": [ -92.47546, 42.72581 ] } },
{ "type": "Feature", "properties": { "ID": "89", "Year": "1904", "Month": "April", "Day": "11", "Town": "Hampton", "State": "IA", "Venue": "Harriman Opera House: Hampton, IA", "Amount_Made": "43.65", "Notes": "  Partly free  ", "Latitude": "42.742009", "Longitude": "-93.202273", "House_takes": "30", "time": "4\/11\/1904", "Amount_Made_real": 43.65, "Amount_Made_D": "$43.65", "House_Takes_P": "30%", "ID_int": 89, "Month_no": "04", "Date": "11-04-1904", "Date_yyyymmdd": "1904-04-11" }, "geometry": { "type": "Point", "coordinates": [ -93.20227, 42.74201 ] } },
{ "type": "Feature", "properties": { "ID": "90", "Year": "1904", "Month": "April", "Day": "12", "Town": "Hampton", "State": "IA", "Venue": "Harriman Opera House: Hampton, IA", "Amount_Made": "74.35", "Notes": "No Data", "Latitude": "42.742009", "Longitude": "-93.202273", "House_takes": "30", "time": "4\/12\/1904", "Amount_Made_real": 74.35, "Amount_Made_D": "$74.35", "House_Takes_P": "30%", "ID_int": 90, "Month_no": "04", "Date": "12-04-1904", "Date_yyyymmdd": "1904-04-12" }, "geometry": { "type": "Point", "coordinates": [ -93.20227, 42.74201 ] } },
{ "type": "Feature", "properties": { "ID": "91", "Year": "1904", "Month": "April", "Day": "13", "Town": "Hampton", "State": "IA", "Venue": "Harriman Opera House: Hampton, IA", "Amount_Made": "79.9", "Notes": "No Data", "Latitude": "42.742009", "Longitude": "-93.202273", "House_takes": "30", "time": "4\/13\/1904", "Amount_Made_real": 79.9, "Amount_Made_D": "$79.90", "House_Takes_P": "30%", "ID_int": 91, "Month_no": "04", "Date": "13-04-1904", "Date_yyyymmdd": "1904-04-13" }, "geometry": { "type": "Point", "coordinates": [ -93.20227, 42.74201 ] } },
{ "type": "Feature", "properties": { "ID": "92", "Year": "1904", "Month": "April", "Day": "14", "Town": "Sheffield", "State": "IA", "Venue": "Town Hall: Sheffield, IA", "Amount_Made": "16.7", "Notes": "No Data", "Latitude": "42.893517", "Longitude": "-93.215192", "House_takes": "25", "time": "4\/14\/1904", "Amount_Made_real": 16.7, "Amount_Made_D": "$16.70", "House_Takes_P": "25%", "ID_int": 92, "Month_no": "04", "Date": "14-04-1904", "Date_yyyymmdd": "1904-04-14" }, "geometry": { "type": "Point", "coordinates": [ -93.21519, 42.89352 ] } },
{ "type": "Feature", "properties": { "ID": "93", "Year": "1904", "Month": "April", "Day": "15", "Town": "Chapin", "State": "IA", "Venue": "Chapin, IA", "Amount_Made": "30.05", "Notes": "  $3 cash  ", "Latitude": "42.833581", "Longitude": "-93.222146", "House_takes": "10", "time": "4\/15\/1904", "Amount_Made_real": 30.05, "Amount_Made_D": "$30.05", "House_Takes_P": "10%", "ID_int": 93, "Month_no": "04", "Date": "15-04-1904", "Date_yyyymmdd": "1904-04-15" }, "geometry": { "type": "Point", "coordinates": [ -93.22215, 42.83358 ] } },
{ "type": "Feature", "properties": { "ID": "94", "Year": "1904", "Month": "April", "Day": "16", "Town": "Sheffield", "State": "IA", "Venue": "Town Hall: Sheffield, IA", "Amount_Made": "42.8", "Notes": "No Data", "Latitude": "42.893517", "Longitude": "-93.215192", "House_takes": "25", "time": "4\/16\/1904", "Amount_Made_real": 42.8, "Amount_Made_D": "$42.80", "House_Takes_P": "25%", "ID_int": 94, "Month_no": "04", "Date": "16-04-1904", "Date_yyyymmdd": "1904-04-16" }, "geometry": { "type": "Point", "coordinates": [ -93.21519, 42.89352 ] } },
{ "type": "Feature", "properties": { "ID": "95", "Year": "1904", "Month": "April", "Day": "18", "Town": "Eagle Grove", "State": "IA", "Venue": "Eagle Grove Opera House: Eagle Grove, IA", "Amount_Made": "24.55", "Notes": "  Partly free  ", "Latitude": "42.664138", "Longitude": "-93.90439", "House_takes": "35", "time": "4\/18\/1904", "Amount_Made_real": 24.55, "Amount_Made_D": "$24.55", "House_Takes_P": "35%", "ID_int": 95, "Month_no": "04", "Date": "18-04-1904", "Date_yyyymmdd": "1904-04-18" }, "geometry": { "type": "Point", "coordinates": [ -93.90439, 42.66414 ] } },
{ "type": "Feature", "properties": { "ID": "96", "Year": "1904", "Month": "April", "Day": "19", "Town": "Eagle Grove", "State": "IA", "Venue": "Eagle Grove Opera House: Eagle Grove, IA", "Amount_Made": "41.25", "Notes": "No Data", "Latitude": "42.664138", "Longitude": "-93.90439", "House_takes": "35", "time": "4\/19\/1904", "Amount_Made_real": 41.25, "Amount_Made_D": "$41.25", "House_Takes_P": "35%", "ID_int": 96, "Month_no": "04", "Date": "19-04-1904", "Date_yyyymmdd": "1904-04-19" }, "geometry": { "type": "Point", "coordinates": [ -93.90439, 42.66414 ] } },
{ "type": "Feature", "properties": { "ID": "97", "Year": "1904", "Month": "April", "Day": "20", "Town": "Eagle Grove", "State": "IA", "Venue": "Eagle Grove Opera House: Eagle Grove, IA", "Amount_Made": "48.95", "Notes": "No Data", "Latitude": "42.664138", "Longitude": "-93.90439", "House_takes": "35", "time": "4\/20\/1904", "Amount_Made_real": 48.95, "Amount_Made_D": "$48.95", "House_Takes_P": "35%", "ID_int": 97, "Month_no": "04", "Date": "20-04-1904", "Date_yyyymmdd": "1904-04-20" }, "geometry": { "type": "Point", "coordinates": [ -93.90439, 42.66414 ] } },
{ "type": "Feature", "properties": { "ID": "98", "Year": "1904", "Month": "April", "Day": "21", "Town": "Clarion", "State": "IA", "Venue": "Brown Opera House: Clarion, IA", "Amount_Made": "11.45", "Notes": "  Partly free  ", "Latitude": "42.731339", "Longitude": "-93.732208", "House_takes": "40", "time": "4\/21\/1904", "Amount_Made_real": 11.45, "Amount_Made_D": "$11.45", "House_Takes_P": "40%", "ID_int": 98, "Month_no": "04", "Date": "21-04-1904", "Date_yyyymmdd": "1904-04-21" }, "geometry": { "type": "Point", "coordinates": [ -93.73221, 42.73134 ] } },
{ "type": "Feature", "properties": { "ID": "99", "Year": "1904", "Month": "April", "Day": "22", "Town": "Clarion", "State": "IA", "Venue": "Brown Opera House: Clarion, IA", "Amount_Made": "33.3", "Notes": "No Data", "Latitude": "42.731339", "Longitude": "-93.732208", "House_takes": "40", "time": "4\/22\/1904", "Amount_Made_real": 33.3, "Amount_Made_D": "$33.30", "House_Takes_P": "40%", "ID_int": 99, "Month_no": "04", "Date": "22-04-1904", "Date_yyyymmdd": "1904-04-22" }, "geometry": { "type": "Point", "coordinates": [ -93.73221, 42.73134 ] } },
{ "type": "Feature", "properties": { "ID": "100", "Year": "1904", "Month": "April", "Day": "23", "Town": "Clarion", "State": "IA", "Venue": "Brown Opera House: Clarion, IA", "Amount_Made": "10.8", "Notes": "Rained hard    ", "Latitude": "42.731339", "Longitude": "-93.732208", "House_takes": "40", "time": "4\/23\/1904", "Amount_Made_real": 10.8, "Amount_Made_D": "$10.80", "House_Takes_P": "40%", "ID_int": 100, "Month_no": "04", "Date": "23-04-1904", "Date_yyyymmdd": "1904-04-23" }, "geometry": { "type": "Point", "coordinates": [ -93.73221, 42.73134 ] } },
{ "type": "Feature", "properties": { "ID": "101", "Year": "1904", "Month": "April", "Day": "25", "Town": "Mason City", "State": "IA", "Venue": "Wilson Opera House: Mason City, IA", "Amount_Made": "32.95", "Notes": "  Partly free  ", "Latitude": "43.153573", "Longitude": "-93.201037", "House_takes": "50", "time": "4\/25\/1904", "Amount_Made_real": 32.95, "Amount_Made_D": "$32.95", "House_Takes_P": "50%", "ID_int": 101, "Month_no": "04", "Date": "25-04-1904", "Date_yyyymmdd": "1904-04-25" }, "geometry": { "type": "Point", "coordinates": [ -93.20104, 43.15357 ] } },
{ "type": "Feature", "properties": { "ID": "102", "Year": "1904", "Month": "April", "Day": "26", "Town": "Mason City", "State": "IA", "Venue": "Wilson Opera House: Mason City, IA", "Amount_Made": "89.6", "Notes": "No Data", "Latitude": "43.153573", "Longitude": "-93.201037", "House_takes": "50", "time": "4\/26\/1904", "Amount_Made_real": 89.6, "Amount_Made_D": "$89.60", "House_Takes_P": "50%", "ID_int": 102, "Month_no": "04", "Date": "26-04-1904", "Date_yyyymmdd": "1904-04-26" }, "geometry": { "type": "Point", "coordinates": [ -93.20104, 43.15357 ] } },
{ "type": "Feature", "properties": { "ID": "103", "Year": "1904", "Month": "April", "Day": "27", "Town": "Mason City", "State": "IA", "Venue": "Wilson Opera House: Mason City, IA", "Amount_Made": "66.4", "Notes": "No Data", "Latitude": "43.153573", "Longitude": "-93.201037", "House_takes": "50", "time": "4\/27\/1904", "Amount_Made_real": 66.4, "Amount_Made_D": "$66.40", "House_Takes_P": "50%", "ID_int": 103, "Month_no": "04", "Date": "27-04-1904", "Date_yyyymmdd": "1904-04-27" }, "geometry": { "type": "Point", "coordinates": [ -93.20104, 43.15357 ] } },
{ "type": "Feature", "properties": { "ID": "104", "Year": "1904", "Month": "May", "Day": "10", "Town": "Washington", "State": "IA", "Venue": "Graham Opera House: Washington, IA", "Amount_Made": "128.4", "Notes": "  [House takes] $25 cash  ", "Latitude": "41.316008", "Longitude": "-91.734033", "House_takes": "19.5", "time": "5\/10\/1904", "Amount_Made_real": 128.4, "Amount_Made_D": "$128.40", "House_Takes_P": "19.5%", "ID_int": 104, "Month_no": "05", "Date": "10-05-1904", "Date_yyyymmdd": "1904-05-10" }, "geometry": { "type": "Point", "coordinates": [ -91.73403, 41.31601 ] } },
{ "type": "Feature", "properties": { "ID": "105", "Year": "1904", "Month": "May", "Day": "21", "Town": "Ainsworth", "State": "IA", "Venue": "Ainsworth Opera House: Ainsworth, IA", "Amount_Made": "43.6", "Notes": "No Data", "Latitude": "41.28891", "Longitude": "-91.552384", "House_takes": "25", "time": "5\/21\/1904", "Amount_Made_real": 43.6, "Amount_Made_D": "$43.60", "House_Takes_P": "25%", "ID_int": 105, "Month_no": "05", "Date": "21-05-1904", "Date_yyyymmdd": "1904-05-21" }, "geometry": { "type": "Point", "coordinates": [ -91.55238, 41.28891 ] } },
{ "type": "Feature", "properties": { "ID": "106", "Year": "1904", "Month": "May", "Day": "28", "Town": "Wayland", "State": "IA", "Venue": "Wayland, IA", "Amount_Made": "55.25", "Notes": "No Data", "Latitude": "41.147783", "Longitude": "-91.661307", "House_takes": "25", "time": "5\/28\/1904", "Amount_Made_real": 55.25, "Amount_Made_D": "$55.25", "House_Takes_P": "25%", "ID_int": 106, "Month_no": "05", "Date": "28-05-1904", "Date_yyyymmdd": "1904-05-28" }, "geometry": { "type": "Point", "coordinates": [ -91.66131, 41.14778 ] } },
{ "type": "Feature", "properties": { "ID": "107", "Year": "1904", "Month": "June", "Day": "04", "Town": "Kalona", "State": "IA", "Venue": "Kalona Opera House: Kalona, IA", "Amount_Made": "52.85", "Notes": "No Data", "Latitude": "41.475053", "Longitude": "-91.714486", "House_takes": "25", "time": "6\/4\/1904", "Amount_Made_real": 52.85, "Amount_Made_D": "$52.85", "House_Takes_P": "25%", "ID_int": 107, "Month_no": "06", "Date": "04-06-1904", "Date_yyyymmdd": "1904-06-04" }, "geometry": { "type": "Point", "coordinates": [ -91.71449, 41.47505 ] } },
{ "type": "Feature", "properties": { "ID": "108", "Year": "1904", "Month": "June", "Day": "11", "Town": "Crawfordsville", "State": "IA", "Venue": "Crawfordsville Town Hall: Crawfordsville, IA", "Amount_Made": "62.05", "Notes": "No Data", "Latitude": "41.215386", "Longitude": "-91.538751", "House_takes": "25", "time": "6\/11\/1904", "Amount_Made_real": 62.05, "Amount_Made_D": "$62.05", "House_Takes_P": "25%", "ID_int": 108, "Month_no": "06", "Date": "11-06-1904", "Date_yyyymmdd": "1904-06-11" }, "geometry": { "type": "Point", "coordinates": [ -91.53875, 41.21539 ] } },
{ "type": "Feature", "properties": { "ID": "109", "Year": "1904", "Month": "June", "Day": "18", "Town": "Wellman", "State": "IA", "Venue": "Wellman, IA", "Amount_Made": "87.65", "Notes": "No Data", "Latitude": "41.465065", "Longitude": "-91.837854", "House_takes": "25", "time": "6\/18\/1904", "Amount_Made_real": 87.65, "Amount_Made_D": "$87.65", "House_Takes_P": "25%", "ID_int": 109, "Month_no": "06", "Date": "18-06-1904", "Date_yyyymmdd": "1904-06-18" }, "geometry": { "type": "Point", "coordinates": [ -91.83785, 41.46507 ] } },
{ "type": "Feature", "properties": { "ID": "110", "Year": "1904", "Month": "June", "Day": "25", "Town": "Wellman", "State": "IA", "Venue": "Wellman, IA", "Amount_Made": "65.25", "Notes": "No Data", "Latitude": "41.465065", "Longitude": "-91.837854", "House_takes": "25", "time": "6\/25\/1904", "Amount_Made_real": 65.25, "Amount_Made_D": "$65.25", "House_Takes_P": "25%", "ID_int": 110, "Month_no": "06", "Date": "25-06-1904", "Date_yyyymmdd": "1904-06-25" }, "geometry": { "type": "Point", "coordinates": [ -91.83785, 41.46507 ] } },
{ "type": "Feature", "properties": { "ID": "111", "Year": "1904", "Month": "July", "Day": "02", "Town": "Washington", "State": "IA", "Venue": "Poor Farm Near Washington: Washington, IA", "Amount_Made": "0", "Notes": "  Went out to the poor farm and gave a show  ", "Latitude": "41.316008", "Longitude": "-91.734033", "House_takes": "0", "time": "7\/2\/1904", "Amount_Made_real": 0.0, "Amount_Made_D": "$0.00", "House_Takes_P": "0%", "ID_int": 111, "Month_no": "07", "Date": "02-07-1904", "Date_yyyymmdd": "1904-07-02" }, "geometry": { "type": "Point", "coordinates": [ -91.73403, 41.31601 ] } },
{ "type": "Feature", "properties": { "ID": "112", "Year": "1904", "Month": "July", "Day": "04", "Town": "Hedrick", "State": "IA", "Venue": "Baldwin's Hall: Hedrick, IA", "Amount_Made": "", "Notes": "  Business men gave us a guarantee of $75  ", "Latitude": "41.172513", "Longitude": "-92.308794", "House_takes": "0", "time": "7\/4\/1904", "Amount_Made_real": null, "Amount_Made_D": "No Data", "House_Takes_P": "0%", "ID_int": 112, "Month_no": "07", "Date": "04-07-1904", "Date_yyyymmdd": "1904-07-04" }, "geometry": { "type": "Point", "coordinates": [ -92.30879, 41.17251 ] } },
{ "type": "Feature", "properties": { "ID": "113", "Year": "1904", "Month": "July", "Day": "16", "Town": "Brighton", "State": "IA", "Venue": "River Park: Brighton, IA", "Amount_Made": "", "Notes": "  Brighton Park guaranteed us $40  ", "Latitude": "41.174739", "Longitude": "-91.819615", "House_takes": "0", "time": "7\/16\/1904", "Amount_Made_real": null, "Amount_Made_D": "No Data", "House_Takes_P": "0%", "ID_int": 113, "Month_no": "07", "Date": "16-07-1904", "Date_yyyymmdd": "1904-07-16" }, "geometry": { "type": "Point", "coordinates": [ -91.81961, 41.17474 ] } },
{ "type": "Feature", "properties": { "ID": "114", "Year": "1904", "Month": "July", "Day": "23", "Town": "Crawfordsville", "State": "IA", "Venue": "Crawfordsville Town Hall: Crawfordsville, IA", "Amount_Made": "26.4", "Notes": "  not well advertised  ", "Latitude": "41.215386", "Longitude": "-91.538751", "House_takes": "25", "time": "7\/23\/1904", "Amount_Made_real": 26.4, "Amount_Made_D": "$26.40", "House_Takes_P": "25%", "ID_int": 114, "Month_no": "07", "Date": "23-07-1904", "Date_yyyymmdd": "1904-07-23" }, "geometry": { "type": "Point", "coordinates": [ -91.53875, 41.21539 ] } },
{ "type": "Feature", "properties": { "ID": "115", "Year": "1904", "Month": "July", "Day": "30", "Town": "West Chester", "State": "IA", "Venue": "Baptist Church: West Chester, IA", "Amount_Made": "25.15", "Notes": "Rain    ", "Latitude": "41.338904", "Longitude": "-91.817671", "House_takes": "25", "time": "7\/30\/1904", "Amount_Made_real": 25.15, "Amount_Made_D": "$25.15", "House_Takes_P": "25%", "ID_int": 115, "Month_no": "07", "Date": "30-07-1904", "Date_yyyymmdd": "1904-07-30" }, "geometry": { "type": "Point", "coordinates": [ -91.81767, 41.3389 ] } },
{ "type": "Feature", "properties": { "ID": "116", "Year": "1904", "Month": "August", "Day": "06", "Town": "Brighton", "State": "IA", "Venue": "River Park: Brighton, IA", "Amount_Made": "45.7", "Notes": "No Data", "Latitude": "41.174739", "Longitude": "-91.819615", "House_takes": "25", "time": "8\/6\/1904", "Amount_Made_real": 45.7, "Amount_Made_D": "$45.70", "House_Takes_P": "25%", "ID_int": 116, "Month_no": "08", "Date": "06-08-1904", "Date_yyyymmdd": "1904-08-06" }, "geometry": { "type": "Point", "coordinates": [ -91.81961, 41.17474 ] } },
{ "type": "Feature", "properties": { "ID": "117", "Year": "1904", "Month": "August", "Day": "13", "Town": "Wayland", "State": "IA", "Venue": "Wayland, IA", "Amount_Made": "31.95", "Notes": "No Data", "Latitude": "41.147783", "Longitude": "-91.661307", "House_takes": "25", "time": "8\/13\/1904", "Amount_Made_real": 31.95, "Amount_Made_D": "$31.95", "House_Takes_P": "25%", "ID_int": 117, "Month_no": "08", "Date": "13-08-1904", "Date_yyyymmdd": "1904-08-13" }, "geometry": { "type": "Point", "coordinates": [ -91.66131, 41.14778 ] } },
{ "type": "Feature", "properties": { "ID": "118", "Year": "1904", "Month": "August", "Day": "27", "Town": "Kalona", "State": "IA", "Venue": "Kalona Opera House: Kalona, IA", "Amount_Made": "69.3", "Notes": "No Data", "Latitude": "41.483072", "Longitude": "-91.706002", "House_takes": "25", "time": "8\/27\/1904", "Amount_Made_real": 69.3, "Amount_Made_D": "$69.30", "House_Takes_P": "25%", "ID_int": 118, "Month_no": "08", "Date": "27-08-1904", "Date_yyyymmdd": "1904-08-27" }, "geometry": { "type": "Point", "coordinates": [ -91.706, 41.48307 ] } },
{ "type": "Feature", "properties": { "ID": "119", "Year": "1904", "Month": "September", "Day": "10", "Town": "Washington", "State": "IA", "Venue": "Graham Opera House: Washington, IA", "Amount_Made": "145.5", "Notes": "No Data", "Latitude": "41.316008", "Longitude": "-91.734033", "House_takes": "0", "time": "9\/10\/1904", "Amount_Made_real": 145.5, "Amount_Made_D": "$145.50", "House_Takes_P": "0%", "ID_int": 119, "Month_no": "09", "Date": "10-09-1904", "Date_yyyymmdd": "1904-09-10" }, "geometry": { "type": "Point", "coordinates": [ -91.73403, 41.31601 ] } },
{ "type": "Feature", "properties": { "ID": "120", "Year": "1904", "Month": "September", "Day": "13", "Town": "Keota", "State": "IA", "Venue": "Keota, IA", "Amount_Made": "114.05", "Notes": "No Data", "Latitude": "41.363902", "Longitude": "-91.953786", "House_takes": "0", "time": "9\/13\/1904", "Amount_Made_real": 114.05, "Amount_Made_D": "$114.05", "House_Takes_P": "0%", "ID_int": 120, "Month_no": "09", "Date": "13-09-1904", "Date_yyyymmdd": "1904-09-13" }, "geometry": { "type": "Point", "coordinates": [ -91.95379, 41.3639 ] } },
{ "type": "Feature", "properties": { "ID": "121", "Year": "1904", "Month": "September", "Day": "14", "Town": "Sigourney", "State": "IA", "Venue": "Sigourney, IA", "Amount_Made": "81.1", "Notes": "No Data", "Latitude": "41.333046", "Longitude": "-92.20484", "House_takes": "0", "time": "9\/14\/1904", "Amount_Made_real": 81.1, "Amount_Made_D": "$81.10", "House_Takes_P": "0%", "ID_int": 121, "Month_no": "09", "Date": "14-09-1904", "Date_yyyymmdd": "1904-09-14" }, "geometry": { "type": "Point", "coordinates": [ -92.20484, 41.33305 ] } },
{ "type": "Feature", "properties": { "ID": "122", "Year": "1904", "Month": "September", "Day": "15", "Town": "Hendrick", "State": "IA", "Venue": "Hendrick, IA", "Amount_Made": "57.9", "Notes": "No Data", "Latitude": "41.17448", "Longitude": "-92.308461", "House_takes": "0", "time": "9\/15\/1904", "Amount_Made_real": 57.9, "Amount_Made_D": "$57.90", "House_Takes_P": "0%", "ID_int": 122, "Month_no": "09", "Date": "15-09-1904", "Date_yyyymmdd": "1904-09-15" }, "geometry": { "type": "Point", "coordinates": [ -92.30846, 41.17448 ] } },
{ "type": "Feature", "properties": { "ID": "123", "Year": "1904", "Month": "September", "Day": "16", "Town": "Richland", "State": "IA", "Venue": "Richland, IA", "Amount_Made": "133.3", "Notes": "No Data", "Latitude": "41.185571", "Longitude": "-91.992953", "House_takes": "0", "time": "9\/16\/1904", "Amount_Made_real": 133.3, "Amount_Made_D": "$133.30", "House_Takes_P": "0%", "ID_int": 123, "Month_no": "09", "Date": "16-09-1904", "Date_yyyymmdd": "1904-09-16" }, "geometry": { "type": "Point", "coordinates": [ -91.99295, 41.18557 ] } },
{ "type": "Feature", "properties": { "ID": "124", "Year": "1904", "Month": "September", "Day": "17", "Town": "Brighton", "State": "IA", "Venue": "Brighton, IA", "Amount_Made": "89.7", "Notes": "  Gas did not come\nCharge 10 + 20 cts.  ", "Latitude": "41.174739", "Longitude": "-91.819615", "House_takes": "0", "time": "9\/17\/1904", "Amount_Made_real": 89.7, "Amount_Made_D": "$89.70", "House_Takes_P": "0%", "ID_int": 124, "Month_no": "09", "Date": "17-09-1904", "Date_yyyymmdd": "1904-09-17" }, "geometry": { "type": "Point", "coordinates": [ -91.81961, 41.17474 ] } },
{ "type": "Feature", "properties": { "ID": "125", "Year": "1904", "Month": "September", "Day": "21", "Town": "Mount Pleasant", "State": "IA", "Venue": "Mount Pleasant, IA", "Amount_Made": "110.95", "Notes": "No Data", "Latitude": "40.963695", "Longitude": "-91.558073", "House_takes": "0", "time": "9\/21\/1904", "Amount_Made_real": 110.95, "Amount_Made_D": "$110.95", "House_Takes_P": "0%", "ID_int": 125, "Month_no": "09", "Date": "21-09-1904", "Date_yyyymmdd": "1904-09-21" }, "geometry": { "type": "Point", "coordinates": [ -91.55807, 40.9637 ] } },
{ "type": "Feature", "properties": { "ID": "126", "Year": "1904", "Month": "September", "Day": "22", "Town": "Mount Pleasant", "State": "IA", "Venue": "Mount Pleasant, IA", "Amount_Made": "77.95", "Notes": "No Data", "Latitude": "40.963695", "Longitude": "-91.558073", "House_takes": "0", "time": "9\/22\/1904", "Amount_Made_real": 77.95, "Amount_Made_D": "$77.95", "House_Takes_P": "0%", "ID_int": 126, "Month_no": "09", "Date": "22-09-1904", "Date_yyyymmdd": "1904-09-22" }, "geometry": { "type": "Point", "coordinates": [ -91.55807, 40.9637 ] } },
{ "type": "Feature", "properties": { "ID": "127", "Year": "1904", "Month": "September", "Day": "23", "Town": "Mount Pleasant", "State": "IA", "Venue": "Mount Pleasant, IA", "Amount_Made": "40", "Notes": "No Data", "Latitude": "40.963695", "Longitude": "-91.558073", "House_takes": "0", "time": "9\/23\/1904", "Amount_Made_real": 40.0, "Amount_Made_D": "$40.00", "House_Takes_P": "0%", "ID_int": 127, "Month_no": "09", "Date": "23-09-1904", "Date_yyyymmdd": "1904-09-23" }, "geometry": { "type": "Point", "coordinates": [ -91.55807, 40.9637 ] } },
{ "type": "Feature", "properties": { "ID": "128", "Year": "1904", "Month": "October", "Day": "09", "Town": "Washington", "State": "IA", "Venue": "Graham Opera House: Washington, IA", "Amount_Made": "145.5", "Notes": "No Data", "Latitude": "41.316008", "Longitude": "-91.734033", "House_takes": "0", "time": "10\/9\/1904", "Amount_Made_real": 145.5, "Amount_Made_D": "$145.50", "House_Takes_P": "0%", "ID_int": 128, "Month_no": "10", "Date": "09-10-1904", "Date_yyyymmdd": "1904-10-09" }, "geometry": { "type": "Point", "coordinates": [ -91.73403, 41.31601 ] } },
{ "type": "Feature", "properties": { "ID": "129", "Year": "1904", "Month": "October", "Day": "20", "Town": "Richland", "State": "IA", "Venue": "Richland Church: Richland, IA", "Amount_Made": "24.85", "Notes": "  Ina stayed at home. Frank and Roy to [Richland, IA]  ", "Latitude": "41.185571", "Longitude": "-91.992953", "House_takes": "25", "time": "10\/20\/1904", "Amount_Made_real": 24.85, "Amount_Made_D": "$24.85", "House_Takes_P": "25%", "ID_int": 129, "Month_no": "10", "Date": "20-10-1904", "Date_yyyymmdd": "1904-10-20" }, "geometry": { "type": "Point", "coordinates": [ -91.99295, 41.18557 ] } },
{ "type": "Feature", "properties": { "ID": "130", "Year": "1904", "Month": "October", "Day": "21", "Town": "Martinsburg", "State": "IA", "Venue": "Alexander Hall: Martinsburg, IA", "Amount_Made": "29", "Notes": "  $2.00 cash  ", "Latitude": "41.178903", "Longitude": "-92.251849", "House_takes": "6.89", "time": "10\/21\/1904", "Amount_Made_real": 29.0, "Amount_Made_D": "$29.00", "House_Takes_P": "6.89%", "ID_int": 130, "Month_no": "10", "Date": "21-10-1904", "Date_yyyymmdd": "1904-10-21" }, "geometry": { "type": "Point", "coordinates": [ -92.25185, 41.1789 ] } },
{ "type": "Feature", "properties": { "ID": "131", "Year": "1904", "Month": "October", "Day": "22", "Town": "Ollie", "State": "IA", "Venue": "LaToska Opera House: Ollie, IA", "Amount_Made": "25", "Notes": "  $2 cash  ", "Latitude": "41.198372", "Longitude": "-92.093089", "House_takes": "8", "time": "10\/22\/1904", "Amount_Made_real": 25.0, "Amount_Made_D": "$25.00", "House_Takes_P": "8%", "ID_int": 131, "Month_no": "10", "Date": "22-10-1904", "Date_yyyymmdd": "1904-10-22" }, "geometry": { "type": "Point", "coordinates": [ -92.09309, 41.19837 ] } },
{ "type": "Feature", "properties": { "ID": "132", "Year": "1904", "Month": "October", "Day": "24", "Town": "Fremont", "State": "IA", "Venue": "Fremont, IA", "Amount_Made": "6.7", "Notes": "  Partly free\nIna left Washington and came to [Fremont, IA]\n$2 a night cash, $1 night [for] night license  ", "Latitude": "40.734594", "Longitude": "-95.592478", "House_takes": "0", "time": "10\/24\/1904", "Amount_Made_real": 6.7, "Amount_Made_D": "$6.70", "House_Takes_P": "0%", "ID_int": 132, "Month_no": "10", "Date": "24-10-1904", "Date_yyyymmdd": "1904-10-24" }, "geometry": { "type": "Point", "coordinates": [ -95.59248, 40.73459 ] } },
{ "type": "Feature", "properties": { "ID": "133", "Year": "1904", "Month": "October", "Day": "25", "Town": "Fremont", "State": "IA", "Venue": "Fremont, IA", "Amount_Made": "25.25", "Notes": "  $2 a night cash, $1 night [for] night license  ", "Latitude": "40.734594", "Longitude": "-95.592478", "House_takes": "0", "time": "10\/25\/1904", "Amount_Made_real": 25.25, "Amount_Made_D": "$25.25", "House_Takes_P": "0%", "ID_int": 133, "Month_no": "10", "Date": "25-10-1904", "Date_yyyymmdd": "1904-10-25" }, "geometry": { "type": "Point", "coordinates": [ -95.59248, 40.73459 ] } },
{ "type": "Feature", "properties": { "ID": "134", "Year": "1904", "Month": "October", "Day": "26", "Town": "Fremont", "State": "IA", "Venue": "Fremont, IA", "Amount_Made": "25.15", "Notes": "  $2 a night cash, $1 night [for] night license\nTook dinner with Mr. and Mrs. Roof  ", "Latitude": "40.734594", "Longitude": "-95.592478", "House_takes": "0", "time": "10\/26\/1904", "Amount_Made_real": 25.15, "Amount_Made_D": "$25.15", "House_Takes_P": "0%", "ID_int": 134, "Month_no": "10", "Date": "26-10-1904", "Date_yyyymmdd": "1904-10-26" }, "geometry": { "type": "Point", "coordinates": [ -95.59248, 40.73459 ] } },
{ "type": "Feature", "properties": { "ID": "135", "Year": "1904", "Month": "October", "Day": "27", "Town": "Eddyville", "State": "IA", "Venue": "Opera House: Eddyville, IA", "Amount_Made": "14.55", "Notes": "  Partly free\n$10 cash  ", "Latitude": "41.157248", "Longitude": "-92.634372", "House_takes": "68.7", "time": "10\/27\/1904", "Amount_Made_real": 14.55, "Amount_Made_D": "$14.55", "House_Takes_P": "68.7%", "ID_int": 135, "Month_no": "10", "Date": "27-10-1904", "Date_yyyymmdd": "1904-10-27" }, "geometry": { "type": "Point", "coordinates": [ -92.63437, 41.15725 ] } },
{ "type": "Feature", "properties": { "ID": "136", "Year": "1904", "Month": "October", "Day": "28", "Town": "Eddyville", "State": "IA", "Venue": "Opera House: Eddyville, IA", "Amount_Made": "45.5", "Notes": "  $10 cash  ", "Latitude": "41.157248", "Longitude": "-92.634372", "House_takes": "21.97", "time": "10\/28\/1904", "Amount_Made_real": 45.5, "Amount_Made_D": "$45.50", "House_Takes_P": "21.97%", "ID_int": 136, "Month_no": "10", "Date": "28-10-1904", "Date_yyyymmdd": "1904-10-28" }, "geometry": { "type": "Point", "coordinates": [ -92.63437, 41.15725 ] } },
{ "type": "Feature", "properties": { "ID": "137", "Year": "1904", "Month": "October", "Day": "29", "Town": "Eddyville", "State": "IA", "Venue": "Opera House: Eddyville, IA", "Amount_Made": "49.5", "Notes": "  $10 cash  ", "Latitude": "41.157248", "Longitude": "-92.634372", "House_takes": "20.2", "time": "10\/29\/1904", "Amount_Made_real": 49.5, "Amount_Made_D": "$49.50", "House_Takes_P": "20.2%", "ID_int": 137, "Month_no": "10", "Date": "29-10-1904", "Date_yyyymmdd": "1904-10-29" }, "geometry": { "type": "Point", "coordinates": [ -92.63437, 41.15725 ] } },
{ "type": "Feature", "properties": { "ID": "138", "Year": "1904", "Month": "October", "Day": "31", "Town": "Grinnell", "State": "IA", "Venue": "United Methodist Church: Grinnell, IA", "Amount_Made": "50", "Notes": "No Data", "Latitude": "41.743055", "Longitude": "-92.722421", "House_takes": "0", "time": "10\/31\/1904", "Amount_Made_real": 50.0, "Amount_Made_D": "$50.00", "House_Takes_P": "0%", "ID_int": 138, "Month_no": "10", "Date": "31-10-1904", "Date_yyyymmdd": "1904-10-31" }, "geometry": { "type": "Point", "coordinates": [ -92.72242, 41.74305 ] } },
{ "type": "Feature", "properties": { "ID": "139", "Year": "1904", "Month": "November", "Day": "01", "Town": "Grinnell", "State": "IA", "Venue": "United Methodist Church: Grinnell, IA", "Amount_Made": "82.3", "Notes": "No Data", "Latitude": "41.743055", "Longitude": "-92.722421", "House_takes": "0", "time": "11\/1\/1904", "Amount_Made_real": 82.3, "Amount_Made_D": "$82.30", "House_Takes_P": "0%", "ID_int": 139, "Month_no": "11", "Date": "01-11-1904", "Date_yyyymmdd": "1904-11-01" }, "geometry": { "type": "Point", "coordinates": [ -92.72242, 41.74305 ] } },
{ "type": "Feature", "properties": { "ID": "140", "Year": "1904", "Month": "November", "Day": "02", "Town": "Grinnell", "State": "IA", "Venue": "United Methodist Church: Grinnell, IA", "Amount_Made": "95.85", "Notes": "No Data", "Latitude": "41.743055", "Longitude": "-92.722421", "House_takes": "0", "time": "11\/2\/1904", "Amount_Made_real": 95.85, "Amount_Made_D": "$95.85", "House_Takes_P": "0%", "ID_int": 140, "Month_no": "11", "Date": "02-11-1904", "Date_yyyymmdd": "1904-11-02" }, "geometry": { "type": "Point", "coordinates": [ -92.72242, 41.74305 ] } },
{ "type": "Feature", "properties": { "ID": "141", "Year": "1904", "Month": "November", "Day": "03", "Town": "Montezuma", "State": "IA", "Venue": "Montezuma Opera House", "Amount_Made": "96.6", "Notes": "No Data", "Latitude": "41.584878", "Longitude": "-92.527431", "House_takes": "25", "time": "11\/3\/1904", "Amount_Made_real": 96.6, "Amount_Made_D": "$96.60", "House_Takes_P": "25%", "ID_int": 141, "Month_no": "11", "Date": "03-11-1904", "Date_yyyymmdd": "1904-11-03" }, "geometry": { "type": "Point", "coordinates": [ -92.52743, 41.58488 ] } },
{ "type": "Feature", "properties": { "ID": "142", "Year": "1904", "Month": "November", "Day": "04", "Town": "What Cheer", "State": "IA", "Venue": "Masonic Opera House", "Amount_Made": "44.3", "Notes": "No Data", "Latitude": "41.401397", "Longitude": "-92.354629", "House_takes": "35", "time": "11\/4\/1904", "Amount_Made_real": 44.3, "Amount_Made_D": "$44.30", "House_Takes_P": "35%", "ID_int": 142, "Month_no": "11", "Date": "04-11-1904", "Date_yyyymmdd": "1904-11-04" }, "geometry": { "type": "Point", "coordinates": [ -92.35463, 41.4014 ] } },
{ "type": "Feature", "properties": { "ID": "143", "Year": "1904", "Month": "November", "Day": "05", "Town": "What Cheer", "State": "IA", "Venue": "Masonic Opera House", "Amount_Made": "40.65", "Notes": "No Data", "Latitude": "41.401397", "Longitude": "-92.354629", "House_takes": "35", "time": "11\/5\/1904", "Amount_Made_real": 40.65, "Amount_Made_D": "$40.65", "House_Takes_P": "35%", "ID_int": 143, "Month_no": "11", "Date": "05-11-1904", "Date_yyyymmdd": "1904-11-05" }, "geometry": { "type": "Point", "coordinates": [ -92.35463, 41.4014 ] } },
{ "type": "Feature", "properties": { "ID": "144", "Year": "1904", "Month": "November", "Day": "08", "Town": "Washington", "State": "IA", "Venue": "Graham Opera House: Washington, IA", "Amount_Made": "128.65", "Notes": "  Election\n[House takes] $25 cash  ", "Latitude": "41.316008", "Longitude": "-91.734033", "House_takes": "19.4", "time": "11\/8\/1904", "Amount_Made_real": 128.65, "Amount_Made_D": "$128.65", "House_Takes_P": "19.4%", "ID_int": 144, "Month_no": "11", "Date": "08-11-1904", "Date_yyyymmdd": "1904-11-08" }, "geometry": { "type": "Point", "coordinates": [ -91.73403, 41.31601 ] } },
{ "type": "Feature", "properties": { "ID": "145", "Year": "1904", "Month": "November", "Day": "10", "Town": "Kalona", "State": "IA", "Venue": "Kalona Opera House: Kalona, IA", "Amount_Made": "25.45", "Notes": "  Drove\nDark when we arrived\nNot well advertised   ", "Latitude": "41.483072", "Longitude": "-91.706002", "House_takes": "25", "time": "11\/10\/1904", "Amount_Made_real": 25.45, "Amount_Made_D": "$25.45", "House_Takes_P": "25%", "ID_int": 145, "Month_no": "11", "Date": "10-11-1904", "Date_yyyymmdd": "1904-11-10" }, "geometry": { "type": "Point", "coordinates": [ -91.706, 41.48307 ] } },
{ "type": "Feature", "properties": { "ID": "146", "Year": "1904", "Month": "November", "Day": "11", "Town": "Wellman", "State": "IA", "Venue": "Wellman, IA", "Amount_Made": "62.8", "Notes": "No Data", "Latitude": "41.465065", "Longitude": "-91.837854", "House_takes": "25", "time": "11\/11\/1904", "Amount_Made_real": 62.8, "Amount_Made_D": "$62.80", "House_Takes_P": "25%", "ID_int": 146, "Month_no": "11", "Date": "11-11-1904", "Date_yyyymmdd": "1904-11-11" }, "geometry": { "type": "Point", "coordinates": [ -91.83785, 41.46507 ] } },
{ "type": "Feature", "properties": { "ID": "147", "Year": "1904", "Month": "November", "Day": "12", "Town": "Webster", "State": "IA", "Venue": "Webster, IA", "Amount_Made": "20.4", "Notes": "  [Over to South English quarantined then caused to not advertised]\n  ", "Latitude": "41.438889", "Longitude": "-92.171841", "House_takes": "20", "time": "11\/12\/1904", "Amount_Made_real": 20.4, "Amount_Made_D": "$20.40", "House_Takes_P": "20%", "ID_int": 147, "Month_no": "11", "Date": "12-11-1904", "Date_yyyymmdd": "1904-11-12" }, "geometry": { "type": "Point", "coordinates": [ -92.17184, 41.43889 ] } },
{ "type": "Feature", "properties": { "ID": "148", "Year": "1904", "Month": "November", "Day": "14", "Town": "Webster", "State": "IA", "Venue": "Webster, IA", "Amount_Made": "18.65", "Notes": "No Data", "Latitude": "41.438889", "Longitude": "-92.171841", "House_takes": "20", "time": "11\/14\/1904", "Amount_Made_real": 18.65, "Amount_Made_D": "$18.65", "House_Takes_P": "20%", "ID_int": 148, "Month_no": "11", "Date": "14-11-1904", "Date_yyyymmdd": "1904-11-14" }, "geometry": { "type": "Point", "coordinates": [ -92.17184, 41.43889 ] } },
{ "type": "Feature", "properties": { "ID": "149", "Year": "1904", "Month": "November", "Day": "15", "Town": "Keswick", "State": "IA", "Venue": "Keswick, IA", "Amount_Made": "26.75", "Notes": "  [House takes] $3.00 cash  ", "Latitude": "41.452508", "Longitude": "-92.239348", "House_takes": "11.2", "time": "11\/15\/1904", "Amount_Made_real": 26.75, "Amount_Made_D": "$26.75", "House_Takes_P": "11.2%", "ID_int": 149, "Month_no": "11", "Date": "15-11-1904", "Date_yyyymmdd": "1904-11-15" }, "geometry": { "type": "Point", "coordinates": [ -92.23935, 41.45251 ] } },
{ "type": "Feature", "properties": { "ID": "150", "Year": "1904", "Month": "November", "Day": "17", "Town": "North English", "State": "IA", "Venue": "Christian Church: North English, IA", "Amount_Made": "52.55", "Notes": "No Data", "Latitude": "41.513898", "Longitude": "-92.076289", "House_takes": "25", "time": "11\/17\/1904", "Amount_Made_real": 52.55, "Amount_Made_D": "$52.55", "House_Takes_P": "25%", "ID_int": 150, "Month_no": "11", "Date": "17-11-1904", "Date_yyyymmdd": "1904-11-17" }, "geometry": { "type": "Point", "coordinates": [ -92.07629, 41.5139 ] } },
{ "type": "Feature", "properties": { "ID": "151", "Year": "1904", "Month": "November", "Day": "18", "Town": "Williamsburg", "State": "IA", "Venue": "Trojan Opera House: Williamsburg, IA", "Amount_Made": "40.45", "Notes": "No Data", "Latitude": "41.661228", "Longitude": "-92.009506", "House_takes": "25", "time": "11\/18\/1904", "Amount_Made_real": 40.45, "Amount_Made_D": "$40.45", "House_Takes_P": "25%", "ID_int": 151, "Month_no": "11", "Date": "18-11-1904", "Date_yyyymmdd": "1904-11-18" }, "geometry": { "type": "Point", "coordinates": [ -92.00951, 41.66123 ] } },
{ "type": "Feature", "properties": { "ID": "152", "Year": "1904", "Month": "November", "Day": "19", "Town": "Williamsburg", "State": "IA", "Venue": "Trojan Opera House: Williamsburg, IA", "Amount_Made": "44.25", "Notes": "No Data", "Latitude": "41.661228", "Longitude": "-92.009506", "House_takes": "25", "time": "11\/19\/1904", "Amount_Made_real": 44.25, "Amount_Made_D": "$44.25", "House_Takes_P": "25%", "ID_int": 152, "Month_no": "11", "Date": "19-11-1904", "Date_yyyymmdd": "1904-11-19" }, "geometry": { "type": "Point", "coordinates": [ -92.00951, 41.66123 ] } },
{ "type": "Feature", "properties": { "ID": "153", "Year": "1904", "Month": "November", "Day": "21", "Town": "Blairstown", "State": "IA", "Venue": "Brian Opera House: Blairstown, IA", "Amount_Made": "7.9", "Notes": "No Data", "Latitude": "41.907089", "Longitude": "-92.083342", "House_takes": "25", "time": "11\/21\/1904", "Amount_Made_real": 7.9, "Amount_Made_D": "$7.90", "House_Takes_P": "25%", "ID_int": 153, "Month_no": "11", "Date": "21-11-1904", "Date_yyyymmdd": "1904-11-21" }, "geometry": { "type": "Point", "coordinates": [ -92.08334, 41.90709 ] } },
{ "type": "Feature", "properties": { "ID": "154", "Year": "1904", "Month": "November", "Day": "22", "Town": "Blairstown", "State": "IA", "Venue": "Brian Opera House: Blairstown, IA", "Amount_Made": "6.2", "Notes": "No Data", "Latitude": "41.907089", "Longitude": "-92.083342", "House_takes": "25", "time": "11\/22\/1904", "Amount_Made_real": 6.2, "Amount_Made_D": "$6.20", "House_Takes_P": "25%", "ID_int": 154, "Month_no": "11", "Date": "22-11-1904", "Date_yyyymmdd": "1904-11-22" }, "geometry": { "type": "Point", "coordinates": [ -92.08334, 41.90709 ] } },
{ "type": "Feature", "properties": { "ID": "155", "Year": "1904", "Month": "November", "Day": "24", "Town": "Norway", "State": "IA", "Venue": "Norway Opera House: Norway, IA", "Amount_Made": "23.4", "Notes": "  [House takes] $4.00 cash\nPartly free  ", "Latitude": "41.902781", "Longitude": "-91.921569", "House_takes": "17.1", "time": "11\/24\/1904", "Amount_Made_real": 23.4, "Amount_Made_D": "$23.40", "House_Takes_P": "17.1%", "ID_int": 155, "Month_no": "11", "Date": "24-11-1904", "Date_yyyymmdd": "1904-11-24" }, "geometry": { "type": "Point", "coordinates": [ -91.92157, 41.90278 ] } },
{ "type": "Feature", "properties": { "ID": "156", "Year": "1904", "Month": "November", "Day": "25", "Town": "Norway", "State": "IA", "Venue": "Norway Opera House: Norway, IA", "Amount_Made": "32.5", "Notes": "  [House takes] $4.00 cash  ", "Latitude": "41.902781", "Longitude": "-91.921569", "House_takes": "12.3", "time": "11\/25\/1904", "Amount_Made_real": 32.5, "Amount_Made_D": "$32.50", "House_Takes_P": "12.3%", "ID_int": 156, "Month_no": "11", "Date": "25-11-1904", "Date_yyyymmdd": "1904-11-25" }, "geometry": { "type": "Point", "coordinates": [ -91.92157, 41.90278 ] } },
{ "type": "Feature", "properties": { "ID": "157", "Year": "1904", "Month": "November", "Day": "26", "Town": "Norway", "State": "IA", "Venue": "Norway Opera House: Norway, IA", "Amount_Made": "21.6", "Notes": "  [House takes] $4.00 cash  ", "Latitude": "41.902781", "Longitude": "-91.921569", "House_takes": "0", "time": "11\/26\/1904", "Amount_Made_real": 21.6, "Amount_Made_D": "$21.60", "House_Takes_P": "0%", "ID_int": 157, "Month_no": "11", "Date": "26-11-1904", "Date_yyyymmdd": "1904-11-26" }, "geometry": { "type": "Point", "coordinates": [ -91.92157, 41.90278 ] } },
{ "type": "Feature", "properties": { "ID": "158", "Year": "1904", "Month": "November", "Day": "28", "Town": "Central City", "State": "IA", "Venue": "Central City, IA", "Amount_Made": "10.4", "Notes": "  Partly free  ", "Latitude": "42.203883", "Longitude": "-91.524056", "House_takes": "25", "time": "11\/28\/1904", "Amount_Made_real": 10.4, "Amount_Made_D": "$10.40", "House_Takes_P": "25%", "ID_int": 158, "Month_no": "11", "Date": "28-11-1904", "Date_yyyymmdd": "1904-11-28" }, "geometry": { "type": "Point", "coordinates": [ -91.52406, 42.20388 ] } },
{ "type": "Feature", "properties": { "ID": "159", "Year": "1904", "Month": "November", "Day": "29", "Town": "Central City", "State": "IA", "Venue": "Central City, IA", "Amount_Made": "20.55", "Notes": "No Data", "Latitude": "42.203883", "Longitude": "-91.524056", "House_takes": "25", "time": "11\/29\/1904", "Amount_Made_real": 20.55, "Amount_Made_D": "$20.55", "House_Takes_P": "25%", "ID_int": 159, "Month_no": "11", "Date": "29-11-1904", "Date_yyyymmdd": "1904-11-29" }, "geometry": { "type": "Point", "coordinates": [ -91.52406, 42.20388 ] } },
{ "type": "Feature", "properties": { "ID": "160", "Year": "1904", "Month": "November", "Day": "30", "Town": "Central City", "State": "IA", "Venue": "Central City, IA", "Amount_Made": "21.75", "Notes": "No Data", "Latitude": "42.203883", "Longitude": "-91.524056", "House_takes": "25", "time": "11\/30\/1904", "Amount_Made_real": 21.75, "Amount_Made_D": "$21.75", "House_Takes_P": "25%", "ID_int": 160, "Month_no": "11", "Date": "30-11-1904", "Date_yyyymmdd": "1904-11-30" }, "geometry": { "type": "Point", "coordinates": [ -91.52406, 42.20388 ] } },
{ "type": "Feature", "properties": { "ID": "161", "Year": "1904", "Month": "December", "Day": "01", "Town": "Manchester", "State": "IA", "Venue": "Central Opera House: Manchester, IA", "Amount_Made": "11", "Notes": "  Partly free  ", "Latitude": "42.484154", "Longitude": "-91.455425", "House_takes": "30", "time": "12\/1\/1904", "Amount_Made_real": 11.0, "Amount_Made_D": "$11.00", "House_Takes_P": "30%", "ID_int": 161, "Month_no": "12", "Date": "01-12-1904", "Date_yyyymmdd": "1904-12-01" }, "geometry": { "type": "Point", "coordinates": [ -91.45543, 42.48415 ] } },
{ "type": "Feature", "properties": { "ID": "162", "Year": "1904", "Month": "December", "Day": "02", "Town": "Manchester", "State": "IA", "Venue": "Central Opera House: Manchester, IA", "Amount_Made": "24.35", "Notes": "No Data", "Latitude": "42.484154", "Longitude": "-91.455425", "House_takes": "30", "time": "12\/2\/1904", "Amount_Made_real": 24.35, "Amount_Made_D": "$24.35", "House_Takes_P": "30%", "ID_int": 162, "Month_no": "12", "Date": "02-12-1904", "Date_yyyymmdd": "1904-12-02" }, "geometry": { "type": "Point", "coordinates": [ -91.45543, 42.48415 ] } },
{ "type": "Feature", "properties": { "ID": "163", "Year": "1904", "Month": "December", "Day": "03", "Town": "Manchester", "State": "IA", "Venue": "Central Opera House: Manchester, IA", "Amount_Made": "6", "Notes": "  Matinee  ", "Latitude": "42.484154", "Longitude": "-91.455425", "House_takes": "30", "time": "12\/3\/1904", "Amount_Made_real": 6.0, "Amount_Made_D": "$6.00", "House_Takes_P": "30%", "ID_int": 163, "Month_no": "12", "Date": "03-12-1904", "Date_yyyymmdd": "1904-12-03" }, "geometry": { "type": "Point", "coordinates": [ -91.45543, 42.48415 ] } },
{ "type": "Feature", "properties": { "ID": "164", "Year": "1904", "Month": "December", "Day": "03", "Town": "Manchester", "State": "IA", "Venue": "Central Opera House: Manchester, IA", "Amount_Made": "14.05", "Notes": "No Data", "Latitude": "42.484154", "Longitude": "-91.455425", "House_takes": "30", "time": "12\/3\/1904", "Amount_Made_real": 14.05, "Amount_Made_D": "$14.05", "House_Takes_P": "30%", "ID_int": 164, "Month_no": "12", "Date": "03-12-1904", "Date_yyyymmdd": "1904-12-03" }, "geometry": { "type": "Point", "coordinates": [ -91.45543, 42.48415 ] } },
{ "type": "Feature", "properties": { "ID": "165", "Year": "1904", "Month": "December", "Day": "05", "Town": "Cascade", "State": "IA", "Venue": "Cascade Opera House: Cascade, IA", "Amount_Made": "53.15", "Notes": "No Data", "Latitude": "42.298488", "Longitude": "-91.014223", "House_takes": "25", "time": "12\/5\/1904", "Amount_Made_real": 53.15, "Amount_Made_D": "$53.15", "House_Takes_P": "25%", "ID_int": 165, "Month_no": "12", "Date": "05-12-1904", "Date_yyyymmdd": "1904-12-05" }, "geometry": { "type": "Point", "coordinates": [ -91.01422, 42.29849 ] } },
{ "type": "Feature", "properties": { "ID": "166", "Year": "1904", "Month": "December", "Day": "06", "Town": "Cascade", "State": "IA", "Venue": "Cascade Opera House: Cascade, IA", "Amount_Made": "49", "Notes": "No Data", "Latitude": "42.298488", "Longitude": "-91.014223", "House_takes": "25", "time": "12\/6\/1904", "Amount_Made_real": 49.0, "Amount_Made_D": "$49.00", "House_Takes_P": "25%", "ID_int": 166, "Month_no": "12", "Date": "06-12-1904", "Date_yyyymmdd": "1904-12-06" }, "geometry": { "type": "Point", "coordinates": [ -91.01422, 42.29849 ] } },
{ "type": "Feature", "properties": { "ID": "167", "Year": "1904", "Month": "December", "Day": "08", "Town": "Grinnell", "State": "IA", "Venue": "Preston Opera House: Grinnell, IA", "Amount_Made": "79.15", "Notes": "  2 on 1 ticket  ", "Latitude": "41.743055", "Longitude": "-92.722421", "House_takes": "50", "time": "12\/8\/1904", "Amount_Made_real": 79.15, "Amount_Made_D": "$79.15", "House_Takes_P": "50%", "ID_int": 167, "Month_no": "12", "Date": "08-12-1904", "Date_yyyymmdd": "1904-12-08" }, "geometry": { "type": "Point", "coordinates": [ -92.72242, 41.74305 ] } },
{ "type": "Feature", "properties": { "ID": "168", "Year": "1904", "Month": "December", "Day": "09", "Town": "Grinnell", "State": "IA", "Venue": "Preston Opera House: Grinnell, IA", "Amount_Made": "131.8", "Notes": "No Data", "Latitude": "41.743055", "Longitude": "-92.722421", "House_takes": "50", "time": "12\/9\/1904", "Amount_Made_real": 131.8, "Amount_Made_D": "$131.80", "House_Takes_P": "50%", "ID_int": 168, "Month_no": "12", "Date": "09-12-1904", "Date_yyyymmdd": "1904-12-09" }, "geometry": { "type": "Point", "coordinates": [ -92.72242, 41.74305 ] } },
{ "type": "Feature", "properties": { "ID": "169", "Year": "1904", "Month": "December", "Day": "10", "Town": "Grinnell", "State": "IA", "Venue": "Preston Opera House: Grinnell, IA", "Amount_Made": "20.3", "Notes": "  Matinee  ", "Latitude": "41.743055", "Longitude": "-92.722421", "House_takes": "50", "time": "12\/10\/1904", "Amount_Made_real": 20.3, "Amount_Made_D": "$20.30", "House_Takes_P": "50%", "ID_int": 169, "Month_no": "12", "Date": "10-12-1904", "Date_yyyymmdd": "1904-12-10" }, "geometry": { "type": "Point", "coordinates": [ -92.72242, 41.74305 ] } },
{ "type": "Feature", "properties": { "ID": "170", "Year": "1904", "Month": "December", "Day": "10", "Town": "Grinnell", "State": "IA", "Venue": "Preston Opera House: Grinnell, IA", "Amount_Made": "109.85", "Notes": "No Data", "Latitude": "41.743055", "Longitude": "-92.722421", "House_takes": "50", "time": "12\/10\/1904", "Amount_Made_real": 109.85, "Amount_Made_D": "$109.85", "House_Takes_P": "50%", "ID_int": 170, "Month_no": "12", "Date": "10-12-1904", "Date_yyyymmdd": "1904-12-10" }, "geometry": { "type": "Point", "coordinates": [ -92.72242, 41.74305 ] } },
{ "type": "Feature", "properties": { "ID": "171", "Year": "1904", "Month": "December", "Day": "12", "Town": "Brooklyn", "State": "IA", "Venue": "Brooklyn Opera House: Brooklyn, IA", "Amount_Made": "9.1", "Notes": "  Partly free  ", "Latitude": "41.733609", "Longitude": "-92.445463", "House_takes": "30", "time": "12\/12\/1904", "Amount_Made_real": 9.1, "Amount_Made_D": "$9.10", "House_Takes_P": "30%", "ID_int": 171, "Month_no": "12", "Date": "12-12-1904", "Date_yyyymmdd": "1904-12-12" }, "geometry": { "type": "Point", "coordinates": [ -92.44546, 41.73361 ] } },
{ "type": "Feature", "properties": { "ID": "172", "Year": "1904", "Month": "December", "Day": "13", "Town": "Brooklyn", "State": "IA", "Venue": "Brooklyn Opera House: Brooklyn, IA", "Amount_Made": "45.7", "Notes": "No Data", "Latitude": "41.733609", "Longitude": "-92.445463", "House_takes": "30", "time": "12\/13\/1904", "Amount_Made_real": 45.7, "Amount_Made_D": "$45.70", "House_Takes_P": "30%", "ID_int": 172, "Month_no": "12", "Date": "13-12-1904", "Date_yyyymmdd": "1904-12-13" }, "geometry": { "type": "Point", "coordinates": [ -92.44546, 41.73361 ] } },
{ "type": "Feature", "properties": { "ID": "173", "Year": "1904", "Month": "December", "Day": "14", "Town": "Brooklyn", "State": "IA", "Venue": "Brooklyn Opera House: Brooklyn, IA", "Amount_Made": "22.05", "Notes": "No Data", "Latitude": "41.733609", "Longitude": "-92.445463", "House_takes": "30", "time": "12\/14\/1904", "Amount_Made_real": 22.05, "Amount_Made_D": "$22.05", "House_Takes_P": "30%", "ID_int": 173, "Month_no": "12", "Date": "14-12-1904", "Date_yyyymmdd": "1904-12-14" }, "geometry": { "type": "Point", "coordinates": [ -92.44546, 41.73361 ] } },
{ "type": "Feature", "properties": { "ID": "174", "Year": "1904", "Month": "December", "Day": "15", "Town": "Malcom", "State": "IA", "Venue": "Malcom, IA", "Amount_Made": "24.45", "Notes": "No Data", "Latitude": "41.70833", "Longitude": "-92.559076", "House_takes": "25", "time": "12\/15\/1904", "Amount_Made_real": 24.45, "Amount_Made_D": "$24.45", "House_Takes_P": "25%", "ID_int": 174, "Month_no": "12", "Date": "15-12-1904", "Date_yyyymmdd": "1904-12-15" }, "geometry": { "type": "Point", "coordinates": [ -92.55908, 41.70833 ] } },
{ "type": "Feature", "properties": { "ID": "175", "Year": "1904", "Month": "December", "Day": "16", "Town": "Keswick", "State": "IA", "Venue": "Keswick, IA", "Amount_Made": "7.25", "Notes": "  [House takes] $3.00 cash  ", "Latitude": "41.452508", "Longitude": "-92.239348", "House_takes": "41.2", "time": "12\/16\/1904", "Amount_Made_real": 7.25, "Amount_Made_D": "$7.25", "House_Takes_P": "41.2%", "ID_int": 175, "Month_no": "12", "Date": "16-12-1904", "Date_yyyymmdd": "1904-12-16" }, "geometry": { "type": "Point", "coordinates": [ -92.23935, 41.45251 ] } },
{ "type": "Feature", "properties": { "ID": "176", "Year": "1904", "Month": "December", "Day": "17", "Town": "North English", "State": "IA", "Venue": "Christian Church: North English, IA", "Amount_Made": "47.55", "Notes": "No Data", "Latitude": "41.513898", "Longitude": "-92.076289", "House_takes": "25", "time": "12\/17\/1904", "Amount_Made_real": 47.55, "Amount_Made_D": "$47.55", "House_Takes_P": "25%", "ID_int": 176, "Month_no": "12", "Date": "17-12-1904", "Date_yyyymmdd": "1904-12-17" }, "geometry": { "type": "Point", "coordinates": [ -92.07629, 41.5139 ] } },
{ "type": "Feature", "properties": { "ID": "177", "Year": "1904", "Month": "December", "Day": "31", "Town": "Washington", "State": "IA", "Venue": "Graham Opera House: Washington, IA", "Amount_Made": "90.45", "Notes": "  [House takes] $25 cash  ", "Latitude": "41.316008", "Longitude": "-91.734033", "House_takes": "27.6", "time": "12\/31\/1904", "Amount_Made_real": 90.45, "Amount_Made_D": "$90.45", "House_Takes_P": "27.6%", "ID_int": 177, "Month_no": "12", "Date": "31-12-1904", "Date_yyyymmdd": "1904-12-31" }, "geometry": { "type": "Point", "coordinates": [ -91.73403, 41.31601 ] } },
